conference	authors	title	year	DOI
Proceedings of the AAAI Conference on Artificial Intelligence	Rahul Gupta, Soham Pal, Aditya Kanade, and Shirish Shevade	DeepFix: Fixing Common C Language Errors by Deep Learning	2017	NOT_FOUND
Journal of Systems and Software	Xianglong Kong, Lingming Zhang, W Eric Wong, and Bixin Li	The impacts of techniques, programs and tests on automated program repair: An empirical study	2017	NOT_FOUND
Proceedings Companion of the 2017 ACM SIGPLAN International Conference on Systems, Programming, Languages, and Applications: Software for Humanity	Derrick Lin, James Koppel, Angela Chen, and Armando Solar-Lezama	QuixBugs: a multi-lingual program repair benchmark set based on the quixey challenge	2017	10.1145/3135932.3135941
Proceedings of the 2017 11th Joint Meeting on Foundations of Software Engineering	Fan Long, Peter Amidon, and Martin Rinard	Automatic Inference of Code Transforms for Patch Generation	2017	10.1145/3106237.3106253
European Symposium on Research in Computer Security	Siqi Ma, Ferdian Thung, David Lo, Cong Sun, and Robert H Deng	Vurle: Automatic vulnerability detection and repair by learning from examples	2017	10.1007/978-3-319-66399-9_13
Empirical Software Engineering	Matias Martinez, Thomas Durieux, Romain Sommerard, Jifeng Xuan, and Martin Monperrus	Automatic Repair of Real Bugs in Java: A Large-Scale Experiment on the Defects4J Dataset	2017	NOT_FOUND
ACM Computing Surveys	Martin Monperrus	Automatic Software Repair: a Bibliography	2017	NOT_FOUND
Empirical Software Engineering	Manish Motwani, Sandhya Sankaranarayanan, René Just, and Yuriy Brun	Do automated program repair techniques repair hard and important bugs?	2017	10.1007/s10664-017-9550-0
TACAS	ThanhVu Nguyen, Westley Weimer, Deepak Kapur, and Stephanie Forrest	Connecting Program Synthesis and Reachability: Automatic Program Repair Using Test-Input Generation	2017	10.1007/978-3-662-54577-5_17
Proceedings of the 32nd IEEE/ACM International Conference on Automated Software Engineering	Ripon K. Saha, Yingjun Lyu, and Hiroaki Yoshida	Elixir: Effective object-oriented program repair	2017	NOT_FOUND
Proceedings of the 2017 11th Joint Meeting on Foundations of Software Engineering	Liam Schramm	Improving performance of automatic program repair using learned heuristics	2017	10.1145/3106237.3121281
Proceedings of the 39th International Conference on Software Engineering: New Ideas and Emerging Results Track	David Shriver, Sebastian Elbaum, and Kathryn T. Stolee	At the End of Synthesis: Narrowing Program Candidates	2017	10.1109/icse-nier.2017.7
2017 IEEE/ACM 39th International Conference on Software Engineering Companion (ICSE-C)	Shin Hwei Tan, Jooyong Yi, Sergey Mechtaev, Abhik Roychoudhury, et al	Code-flaws: a programming competition benchmark for evaluating automated program repair tools	2017	NOT_FOUND
FSE'17	Y. Tian and B. Ray	Automatically Diagnosing and Repairing Error Handling Bugs in C	2017	10.1145/3106237.3106300
PhD thesis. University of York	Christopher Steven Timperley	Advanced Techniques for Search-Based Program Repair	2017	NOT_FOUND
Proceedings of the Joint Meeting on Foundations of Software Engineering	Sahil Verma and Subhajit Roy	Synergistic debug-repair of heap manipulations	2017	10.1145/3106237.3106263
arXiv preprint arXiv:1711.07163	Ke Wang, Rishabh Singh, and Zhendong Su	Dynamic Neural Program Embedding for Program Repair	2017	NOT_FOUND
arXiv preprint arXiv:1707.05172	Ming Wen, Junjie Chen, Rongxin Wu, Dan Hao, and Shing-Chi Cheung	An empirical analysis of the influence of fault space on search-based automated program repair	2017	NOT_FOUND
Tech. rep. 1707.04742. Arxiv	Martin White, Michele Tufano, Matias Martinez, Martin Monperrus, and Denys Poshyvanyk	Sorting and Transforming Program Repair Ingredients via Deep Learning Code Similarities	2017	NOT_FOUND
Proceedings of the 32nd IEEE/ACM International Conference on Automated Software Engineering (ASE)	Qi Xin and Steven P Reiss	Leveraging syntax-related code for automated program repair	2017	10.1109/ase.2017.8115676
Proceedings of the 39th International Conference on Software Engineering	Yingfei Xiong, Jie Wang, Runfa Yan, Jiachen Zhang, Shi Han, Gang Huang, and Lu Zhang	Precise Condition Synthesis for Program Repair	2017	10.1109/icse.2017.45
IEEE Transactions on Software Engineering	Jifeng Xuan, Matias Martinez, Favio Demarco, Maxime Clément, Sebastian Lamelas, Thomas Durieux, Daniel Le Berre, and Martin Monperrus	Nopol: Automatic Repair of Conditional Statement Bugs in Java Programs	2017	10.1109/tse.2016.2560811
2017 IEEE International Conference on Software Maintenance and Evolution	D. Yang, Y. Qi, and X. Mao	An Empirical Study on the Usage of Fault Localization in Automated Program Repair	2017	10.1109/icsme.2017.37
Proceedings of the 2017 11th Joint Meeting on Foundations of Software Engineering	Jinqiu Yang, Alexey Zhikhartsev, Yuefei Liu, and Lin Tan	Better test cases for better automated program repair	2017	10.1145/3106237.3106274
Proceedings of ESEC/FSE	J. Yi, U. Ahmed, A. Karkare, S. Tan, and A. Roychoudhury	A feasibility study of using automated program repair for introductory programming assignments	2017	10.1145/3106237.3106262
Empirical Software Engineering	Jooyong Yi, Shin Hwei Tan, Sergey Mechtaev, Marcel Böhme, and Abhik Roychoudhury	A correlation study between automated program repair and test-suite metrics	2017	10.1007/s10664-017-9552-y
2017 IEEE International Conference on Software Maintenance and Evolution (ICSME)	Xin Yi, Liqian Chen, Xiaoguang Mao, and Tao Ji	Automated Repair of High Inaccuracies in Numerical Programs	2017	10.1109/icsme.2017.45
Tech. rep. 1712.07804. arXiv	Yuan Yuan and Wolfgang Banzhaf	ARJA: Automated Repair of Java Programs via Multi-Objective Genetic Programming	2017	NOT_FOUND
Proceedings of the 40th International Conference on Software Engineering: Software Engineering Education and Training	Umair Z Ahmed, Pawan Kumar, Amey Karkare, Purushottam Kar, and Sumit Gulwani	Compilation error repair: for the student programs, from the student programs	2018	10.1145/3183377.3183383
2018 International Joint Conference on Neural Networks (IJCNN)	Leonardo Afonso Amorim, Mateus F Freitas, Altino Dantas, Eduardo F de Souza, Celso G Camilo-Junior, and Wellington S Martins	A new word embedding approach to evaluate potential fixes for automated program repair	2018	10.1109/ijcnn.2018.8489079
Proceedings of the 4th International Workshop on Genetic Improvement	Gabin An, Jinhan Kim, and Shin Yoo	Comparing line and AST granularity level for program repair using PyGGI	2018	10.1145/3194810.3194814
International Conference on Testing Software and Systems	Paolo Arcaini, Angelo Gargantini, and Elvinia Riccobene	Interactive Testing and Repairing of Regular Expressions	2018	10.1007/978-3-319-99927-2_1
arXiv preprint arXiv:1809.07353	Larissa Azevedo, Altino Dantas, and Celso G Camilo-Junior	DroidBugs: An Android Benchmark for Automatic Program Repair	2018	NOT_FOUND
2018 IEEE/ACM 40th International Conference on Software Engineering	S. Bhatia, P. Kohli, and R. Singh	Neuro-Symbolic Program Corrector for Introductory Programming Assignments	2018	10.1145/3180155.3180219
Tech. rep. 1807.03200. arXiv	Zimin Chen and Martin Monperrus	The CodRep Machine Learning on Source Code Competition	2018	NOT_FOUND
Tech. rep. 1811.05703. arXiv	Zimin Chen and Martin Monperrus	The Remarkable Role of Similarity in Redundancy-based Program Repair	2018	NOT_FOUND
arXiv preprint arXiv:1804.07133	Lukas Diekmann and Laurence Tratt	Reducing Cascading Parsing Errors Through Fast Error Recovery	2018	NOT_FOUND
PhD thesis. Université de Lille	Thomas Durieux	From Runtime Failures to Patches: Study of Patch Generation in Production	2018	NOT_FOUND
Proceedings of the 29th IEEE International Symposium on Software Reliability Engineering	Thomas Durieux, Youssef Hamadi, and Martin Monperrus	Fully Automated HTML and Javascript Rewriting for Constructing a Self-healing Web Proxy	2018	10.1109/issre.2018.00012
arXiv abs/1807.03512	Ali Ghanbari and Lingming Zhang	Practical Program Repair via Bytecode Mutation	2018	NOT_FOUND
International Conference on Software Maintenance and Evolution	Anbang Guo, Xiaoguang Mao, Deheng Yang, and Shangwen Wang	An Empirical Study on the Effect of Dynamic Slicing on Automated Program Repair Efficiency	2018	10.1109/icsme.2018.00066
arXiv preprint arXiv:1801.10467	Rahul Gupta, Aditya Kanade, and Shirish Shevade	Deep reinforcement learning for programming language correction	2018	NOT_FOUND
Advances in Neural Information Processing Systems	Jacob Harer, Onur Ozdemir, Tomo Lazovich, Christopher Reale, Rebecca Russell, Louis Kim, et al	Learning to repair software vulnerabilities with generative adversarial networks	2018	NOT_FOUND
Proceedings of the 40th International Conference on Software Engineering	Foyzul Hassan and Xiaoyin Wang	HireBuild: an automatic approach to history-driven repair of build scripts	2018	10.1145/3180155.3180181
arXiv preprint 1812.07170	Hideaki Hata, Emad Shihab, and Graham Neubig	Learning to Generate Corrective Patches using Neural Machine Translation	2018	NOT_FOUND
CoRR abs/1803.07522	Qinheping Hu, Isaac Evavold, Roopsha Samanta, Rishabh Singh, and Loris D'Antoni	Program Repair via Direct State Manipulation	2018	NOT_FOUND
PhD thesis. University of Texas at Austin	Jinru Hua	Unifying Program Repair and Program Synthesis	2018	NOT_FOUND
Proceedings of ICSE	Jinru Hua, Mengshi Zhang, Kaiyuan Wang, and Sarfraz Khurshid	Towards Practical Program Repair with On-Demand Candidate Generation	2018	10.1145/3180155.3180245
Proceedings of ISSTA	Jiajun Jiang, Yingfei Xiong, Hongyu Zhang, Qing Gao, and Xiangqun Chen	Shaping Program Repair Space with Existing Patches and Similar Code	2018	10.1145/3213846.3213871
Proceedings of the 27th ACM SIGSOFT International Symposium on Software Testing and Analysis	René Just, Chris Parnin, Ian Drosos, and Michael D Ernst	Comparing developer-provided to user-provided tests for fault localization and automated program repair	2018	10.1145/3213846.3213870
PhD thesis. Singapore Management University	Xuan Bach D Le	Overfitting in Automated Program Repair: Challenges and Solutions	2018	NOT_FOUND
Empirical Software Engineering	Xuan Bach D. Le, Ferdian Thung, David Lo, and Claire Le Goues	Overfitting in semantics-based automated program repair	2018	10.1145/3180155.3182536
Proceedings of the 2018 26th ACM Joint Meeting on European Software Engineering Conference and Symposium on the Foundations of Software Engineering	Junhee Lee, Seongjoon Hong, and Hakjoo Oh	MemFix: static analysis-based repair of memory deallocation errors for C	2018	10.1145/3236024.3236079
Proceedings of OOPSLA	Junho Lee, Dowon Song, Sunbeom So, and Hakjoo Oh	Automatic diagnosis and correction of logical errors for functional programming assignments	2018	NOT_FOUND
PhD thesis. University of Luxembourg	Kui Liu	Deep Pattern Mining for Program Repair	2018	NOT_FOUND
Proceedings of APSEC	Kui Liu, Anil Koyuncu, Kisub Kim, Dongsun Kim, and Tegawendé François D Assise Bissyande	LSRepair: Live Search of Fix Ingredients for Automated Program Repair	2018	10.1109/apsec.2018.00085
2018 IEEE 25th International Conference on Software Analysis, Evolution and Reengineering (SANER)	X. Liu and H. Zhong	Mining Stackoverflow for Program Repair	2018	10.1109/saner.2018.8330202
Journal of Software	Yuzhen Liu, Long Zhang, and Zhenyu Zhang	A Survey of Test Based Automatic Program Repair	2018	10.17706/jsw.13.8.437-452
PhD thesis. Massachusetts Institute of Technology	Fan Long	Automatic patch generation via learning from successful human patches	2018	NOT_FOUND
Proceedings of the 40th International Conference on Software Engineering	Sonai Mahajan, Negarsadat Abolhassani, Phil McMinn, and William GJ Halfond	Automated repair of mobile friendly problems in web pages	2018	10.1145/3180155.3180262
International Conference on Software Testing, Verification and Validation	Sonal Mahajan, Abdulmajeed Alameer, Phil McMinn, and William GJ Halfond	Automated Repair of Internationalization Presentation Failures in Web Pages Using Style Similarity Clustering and Search-Based Techniques	2018	10.1109/icst.2018.00030
SSBSE 2018 10th International Symposium on Search-Based Software Engineering	Matias Martinez and Martin Monperrus	Ultra-Large Repair Search Space with Automatically Mined Templates: the Cardumen Mode of Astor	2018	10.1007/978-3-319-99241-9_3
PhD thesis. National University of Singapore	Sergey Mechtaev	Semantic Program Repair	2018	NOT_FOUND
ACM Transactions on Software Engineering and Methodology	Sergey Mechtaev, Xiang Gao, Shin Hwei Tan, and Abhik Roychoudhury	Test-equivalence Analysis for Automatic Patch Generation	2018	10.1145/3241980
Proceedings of the 40th International Conference on Software Engineering	Sergey Mechtaev, Manh-Dung Nguyen, Yannic Noller, Lars Grunske, and Abhik Roy-choudhury	Semantic Program Repair Using a Reference Implementation	2018	10.1145/3180155.3180247
Tech. rep. 1810.05806. arXiv	Martin Monperrus, Simon Urli, Thomas Durieux, Matias Martinez, Benoit Baudry, and Lionel Seinturier	Human-competitive Patches in Automatic Program Repair with Repairnator	2018	NOT_FOUND
Empirical Software Engineering	Vinicius Paulo L Oliveira, Eduardo Faria de Souza, Claire Le Goues, and Celso G Camilo-Junior	Improved representation and genetic operators for linear genetic programming for automated program repair	2018	10.1007/s10664-017-9562-9
Proceedings of the 15th International Conference on Mining Software Repositories (MSR Data Showcase)	Ripon K. Saha, Yingjun Lyu, Wing Lam, Hiroaki Yoshida, and Mukul R. Prasad	Bugs.jar: A Large-scale, Diverse Dataset of Real-world Java Bugs	2018	10.1145/3196398.3196473
2018 IEEE 25th International Conference on Software Analysis, Evolution and Reengineering (SANER)	Eddie Antonio Santos, Joshua Charles Campbell, Dhvani Patel, Abram Hindle, and José Nelson Amaral	Syntax and sensibility: Using language models to detect and correct syntax errors	2018	10.1109/saner.2018.8330219
ICLR Workshop	Richard Shin, Illia Polosukhin, and Dawn Song	Towards Specification-Directed Program Repair	2018	NOT_FOUND
Proceedings of the 15th International Conference on Mining Software Repositories	Mauricio Soto and Claire Le Goues	Common Statement Kind Changes to Inform Automatic Program Repair	2018	10.1145/3196398.3196472
Proceedings of the Genetic and Evolutionary Computation Conference. GECCO '18	Eduardo Faria de Souza, Claire Le Goues, and Celso Gonçalves Camilo-Junior	A Novel Fitness Function for Automated Program Repair Based on Source Code Checkpoints	2018	10.1145/3205455.3205566
Proceedings of the 2018 26th ACM Joint Meeting on European Software Engineering Conference and Symposium on the Foundations of Software Engineering	Andrea Stocco, Rahulkrishna Yandrapally, and Ali Mesbah	Visual Web Test Repair	2018	10.1145/3236024.3236063
PhD thesis. National University of Singapore	Shin Hwei Tan	Design of repair operators for automated program repair	2018	NOT_FOUND
Proceedings of the International Conference on Software Engineering	Shin Hwei Tan, Zhen Dong, Xiang Gao, and Abhik Roychoudhury	Repairing Crashes in Android Apps	2018	10.1145/3180155.3180243
Proceedings of ICSE	Rijnard van Tonder and Claire Le Goues	Static Automated Program Repair for Heap Properties	2018	10.1145/3180155.3180250
Tech. rep. arXiv preprint 1808.09229	Chadi Trad, Rawad Abou Assi, Wes Masri, and Fadi Zaraket	CFAAR: Control Flow Alteration to Assist Repair	2018	10.1109/issrew.2018.00008
Proceedings of the 33rd ACM/IEEE International Conference on Automated Software Engineering	Michele Tufano, Cody Watson, Gabriele Bavota, Massimiliano Di Penta, Martin White, and Denys Poshyvanyk	An Empirical Investigation into Learning Bug-fixing Patches in the Wild via Neural Machine Translation	2018	10.1145/3238147.3240732
ACM Transactions on Software Engineering and Methodology	Michele Tufano, Cody Watson, Gabriele Bavota, Massimiliano Di Penta, Martin White, and Denys Poshyvanyk	An Empirical Study on Learning Bug-Fixing Patches in the Wild via Neural Machine Translation	2018	NOT_FOUND
40th International Conference on Software Engineering, Track Software Engineering in Practice	Simon Urli, Zhongxing Yu, Lionel Seinturier, and Martin Monperrus	How to Design a Program Repair Bot? Insights from the Repairnator Project	2018	10.1145/3183519.3183540
Proceedings of ICLR	Marko Vasic, Aditya Kanade, Petros Maniatis, and David Bieber	Neural Program Repair by Jointly Learning to Localize and Repair	2018	NOT_FOUND
Proceedings of the 33rd ACM/IEEE International Conference on Automated Software Engineering	Kaiyuan Wang, Allison Sullivan, and Sarfraz Khurshid	Automated model repair for Alloy	2018	10.1145/3238147.3238162
PLDI	Ke Wang, Rishabh Singh, and Zhendong Su	Search, Align, and Repair: Data-driven Feedback Generation for Introductory Programming Exercises	2018	10.1145/3192366.3192384
arXiv e-prints	Shangwen Wang, Ming Wen, Deheng Yang, and Xiaoguang Mao	Attention Please: Consider Mockito when Evaluating Newly Released Automated Program Repair Techniques	2018	NOT_FOUND
Proceedings of ICSE	Ming Wen, Junjie Chen, rongxin wu, Dan Hao, and Shing-Chi Cheung	Context-Aware Patch Generation for Better Automated Program Repair	2018	10.1145/3180155.3180233
Proceedings of the 26th International Symposium on Foundations of Software Engineering New Ideas Track (FSE-NIER)	Chu-Pan Wong, Jens Meinicke, and Christian Kästner	Beyond Testing Configurable Systems: Applying Variational Execution to Automatic Program Repair and Higher Order Mutation Testing	2018	10.1145/3236024.3264837
Proceedings of ICSE	Yingfei Xiong, Xinyuan Liu, Muhan Zeng, Lu Zhang, and Gang Huang	Identifying patch correctness in test-based program repair	2018	NOT_FOUND
Tech. rep. 1805.03454. arXiv	He Ye, Matias Martinez, and Martin Monperrus	A Comprehensive Study of Automatic Program Repair on the QuixBugs Benchmark	2018	NOT_FOUND
Empirical Software Engineering	Zhongxing Yu, Matias Martinez, Benjamin Danglot, Thomas Durieux, and Martin Monperrus	Alleviating Patch Overfitting with Automatic Test Generation: A Study of Feasibility and Effectiveness for the Nopol Repair System	2018	NOT_FOUND
Journal of Systems and Software	Hao Zhong and Hong Mei	Mining repair model for exception-related bug	2018	10.1016/j.jss.2018.03.046
Empirical Software Engineering	Hao Zhong and Na Meng	Towards reusing hints from past fixes - An exploratory study on thousands of real samples	2018	10.1145/3180155.3182550
IEEE Transactions on Software Engineering	Afsoon Afzal, Manish Motwani, Kathryn Stolee, Yuriy Brun, and Claire Le Goues	SOSRepair: Expressive Semantic Search for Real-World Program Repair	2019	NOT_FOUND
Proceedings of the International Conference on Software Maintenance and Evolution	Moumita Asad, Kishan Kumar Ganguly, and Kazi Sakib	Impact Analysis of Syntactic and Semantic Similarities on Patch Prioritization in Automated Program Repair	2019	10.1109/icsme.2019.00050
Proceedings of the 2019 27th ACM Joint Meeting on European Software Engineering Conference and Symposium on the Foundations of Software Engineering	Rohan Bavishi, Hiroaki Yoshida, and Mukul R Prasad	Phoenix: automated data-driven synthesis of repairs for static analysis violations	2019	10.1145/3338906.3338952
arXiv preprint arXiv:1907.06535	José Pablo Cambronero, Jiasi Shen, Jürgen Cito, Elena Glassman, and Martin Rinard	Characterizing Developer Use of Automatically Generated Patches	2019	NOT_FOUND
Tech. rep. 1912.02015. arXiv	Zimin Chen, Steve Kommrusch, and Martin Monperrus	Using Sequence-to-Sequence Learning for Repairing C Vulnerabilities	2019	NOT_FOUND
IEEE Transactions on Software Engineering	Zimin Chen, Steve Kommrusch, Michele Tufano, Louis-Noël Pouchet, Denys Poshyvanyk, and Martin Monperrus	SequenceR: Sequence-to-Sequence Learning for End-to-End Program Repair	2019	NOT_FOUND
IEEE Transactions on Dependable and Secure Computing	Xi Cheng, Min Zhou, Xiaoyu Song, Ming Gu, and Jiaguang Sun	Automatic Integer Error Repair by Proper-Type Inference	2019	NOT_FOUND
Proceedings of the Genetic Improvement Workshop	Zhen Yu Ding, Yiwei Lyu, Christopher S Timperley, and Claire Le Goues	Leveraging Program Invariants to Promote Population Diversity in Search-Based Automatic Program Repair	2019	10.1109/gi.2019.00011
arXiv preprint arXiv:1903.06725	Naji Dmeiri, David A Tomassi, Yichen Wang, Antara Bhowmick, Yen-Chuan Liu, Premkumar Devanbu, Bogdan Vasilescu, and Cindy Rubio-Gonzélez	BugSwarm: Mining and Continuously Growing a Dataset of Reproducible Failures and Fixes	2019	NOT_FOUND
arXiv preprint arXiv:1905.09375	Thomas Durieux and Rui Abreu	Critical Review of BugSwarm for Fault Localization and Program Repair	2019	NOT_FOUND
Proceedings of FSE	Thomas Durieux, Fernanda Madeiral, Matias Martinez, and Rui Abreu	Empirical Review of Java Program Repair Tools: A Large-Scale Experiment on 2,141 Bugs and 23,551 Repair Attempts	2019	NOT_FOUND
International Symposium on Software Testing and Analysis	Xiang Gao, Sergey Mechtaev, and Abhik Roychoudhury	Crash-Avoiding Program Repair	2019	NOT_FOUND
arXiv preprint arXiv:1912.00117	Ali Ghanbari	Validation of Automatically Generated Patches: An Appetizer	2019	NOT_FOUND
Proceedings of the 11th Asia-Pacific Symposium on Internetware	Rongxun Guo, Tianxiao Gu, Yuan Yao, Feng Xu, and Xiaoxing Ma	Speedup automatic program repair using dynamic software updating: an empirical study	2019	10.1145/3361242.3361245
arXiv preprint arXiv:1906.10502	Hossein Hajipour, Apratim Bhattacharya, and Mario Fritz	SampleFix: Learning to Correct Programs by Sampling Diverse Fixes	2019	NOT_FOUND
PhD thesis. Boston University	Jacob Alexander Harer	Improved neural machine translation systems for low resource correction tasks	2019	NOT_FOUND
Proceedings of ASE	Yang Hu, Umair Z Ahmed, Sergey Mechtaev, Ben Leong, and Abhik Roychoudhury	Re-factoring based Program Repair applied to Programming Assignments	2019	10.1109/ase.2019.00044
Proceedings of the 40th IEEE Symposium on Security and Privacy	Zhen Huang, David Lie, Gang Tan, and Trent Jaeger	Using Safety Properties to Generate Vulnerability Patches	2019	10.1109/sp.2019.00071
Science China Information Sciences	Jiajun Jiang, Yingfei Xiong, and Xin Xia	A manual inspection of Defects4J bugs and its implications for automatic program repair	2019	10.1007/s11432-018-1465-6
IEEE Conference on Software Testing, Validation and Verification	Besma Khaireddine, Matias Martinez, and Ali Mili	Program Repair at Arbitrary Fault Depth	2019	10.1109/icst.2019.00056
Empirical Software Engineering	Jindae Kim, Jeongho Kim, Eunseok Lee, and Sunghun Kim	The effectiveness of context-based change application on automatic program repair	2019	10.1007/s10664-019-09770-1
Empirical Software Engineering	Jindae Kim and Sunghun Kim	Automatic patch generation with context-based change application	2019	10.1007/s10664-019-09742-5
Proceedings of the 2019 27th ACM Joint Meeting on European Software Engineering Conference and Symposium on the Foundations of Software Engineering	Anil Koyuncu, Kui Liu, Tegawendé F Bissyandé, Dongsun Kim, Martin Monperrus, Jacques Klein, and Yves Le Traon	iFixR: bug report driven program repair	2019	10.1145/3338906.3338935
Communications of the ACM	Claire Le Goues, Michael Pradel, and Abhik Roychoudhury	Automated Program Repair	2019	10.1145/3318162
Proceedings of the 40th ACM SIGPLAN Conference on Programming Language Design and Implementation	Guangpu Li, Haopeng Liu, Xianglan Chen, Haryadi S Gunawi, and Shan Lu	DFix: automatically fixing timing bugs in distributed systems	2019	NOT_FOUND
2019 12th IEEE Conference on Software Testing, Validation and Verification (ICST)	Xiangyu Li, Marcelo d'Amorim, and Alessandro Orso	Intent-Preserving Test Repair	2019	10.1109/icst.2019.00030
Proceedings of the 12th IEEE International Conference on Software Testing, Verification and Validation	Kui Liu, Anil Koyuncu, Tegawendé F. Bissyandé, Dongsun Kim, Jacques Klein, and Yves Le Traon	You Cannot Fix What You Cannot Find! An Investigation of Fault Localization Bias in Benchmarking Automated Program Repair Systems	2019	10.1109/icst.2019.00020
Proceedings of ISSTA	Kui Liu, Anil Koyuncu, Dongsun Kim, and Tegawendé F Bissyandé	TBar: Revisiting Template-based Automated Program Repair	2019	10.1145/3293882.3330577
Proceedings of SANER	Kui Liu, Anil Koyuncu, Dongsun Kim, and Tegawendé F. Bissyandé	AVATAR: Fixing Semantic Bugs with Fix Patterns of Static Analysis Violations	2019	10.1109/saner.2019.8667970
IEEE Transactions on Software Engineering	Giovanni Liva, Muhammad Taimoor Khan, Martin Pinzger, Francesco Spegni, and Luca Spalazzi	Automatic repair of timestamp comparisons	2019	NOT_FOUND
Proceedings of the 28th ACM SIGSOFT International Symposium on Software Testing and Analysis	Yiling Lou, Junjie Chen, Lingming Zhang, Dan Hao, and Lu Zhang	History-driven build failure fixing: how far are we?	2019	10.1145/3293882.3330578
arXiv preprint arXiv:1910.01270	Yiling Lou, Ali Ghanbari, Xia Li, Lingming Zhang, Dan Hao, and Lu Zhang	Can Automated Program Repair Refine Fault Localization?	2019	NOT_FOUND
ENCORE: Ensemble Learning using Convolution Neural Machine Translation for Automatic Program Repair	Thibaud Lutellier, Lawrence Pang, Viet Hung Pham, Moshi Wei, and Lin Tan	ENCORE: Ensemble Learning using Convolution Neural Machine Translation for Automatic Program Repair	2019	NOT_FOUND
SANER 2019 - 26th IEEE International Conference on Software Analysis, Evolution and Reengineering	Fernanda Madeiral, Simon Urli, Marcelo Maia, and Martin Monperrus	Bears: An Extensible Java Bug Benchmark for Automatic Program Repair Studies	2019	10.1109/saner.2019.8667991
19th SCAM	Diego Marcilio, Carlo A Furia, Rodrigo Bonifécio, and Gustavo Pinto	Automatically Generating Fix Suggestions in Response to Static Code Analysis Warnings	2019	10.1109/scam.2019.00013
