conference	authors	title	year	DOI
ACM Transactions on Programming Languages and Systems (TOPLAS)	Rafael Corchuelo, José A Pérez, Antonio Ruiz, and Miguel Toro	Repairing syntax errors in LR parsers	2002	10.1145/586088.586092
Proceedings of the 25th International Conference on Software Engineering	Christian Nentwich, Wolfgang Emmerich, and Anthony Finkelstein	Consistency Management with Repair Actions	2003	10.1109/icse.2003.1201223
Computer Aided Verification	Barbara Jobstmann, Andreas Griesmayer, and Roderick Bloem	Program Repair As a Game	2005	10.1007/11513988_23
Security & Privacy	S. Sidiroglou and A.D. Keromytis	Countering Network Worms Through Automatic Patch Generation	2005	10.1109/msp.2005.144
Seventh Symposium on Trends in Functional Programming	Louise A. Dennis, Raul Monroy, and Pablo Nogueira	Proof-directed Debugging and Repair	2006	NOT_FOUND
Computer Aided Verification	Andreas Griesmayer, Roderick Bloem, and Byron Cook	Repair of Boolean Programs with An Application to C	2006	10.1007/11817963_33
The Semantic Web: Research and Applications	Aditya Kalyanpur, Bijan Parsia, Evren Sirin, and Bernardo Cuenca-Grau	Repairing Unsatisfiable Concepts in OWL Ontologies	2006	10.1007/11762256_15
Proceedings of the International Conference on Generative Programming and Component Engineering	Westley Weimer	Patches As Better Bug Reports	2006	10.1145/1173706.1173734
Proceedings of the 2nd ACM Symposium on Information, Computer and Communications Security	Z. Lin, X. Jiang, D. Xu, B. Mao, and L. Xie	AutoPaG: Towards Automated Software Patch Generation with Source Code Root Cause Identification and Repair	2007	10.1145/1229285.1267001
Proceedings of the Third International Workshop on Software Engineering for Secure Systems	S. Thomas and L. Williams	Using Automated Fix Generation to Secure SQL Statements	2007	10.1109/sess.2007.12
Companion of the 30th International Conference on Software Engineering	Andrea Arcuri	On the Automation of Fixing Software Bugs	2008	10.1145/1370175.1370223
Proceedings of the IEEE Congress on Evolutionary Computation	Andrea Arcuri and Xin Yao	A Novel Co-evolutionary Approach to Automatic Software Bug Fixing	2008	10.1109/cec.2008.4630793
ACM Transactions on Software Engineering and Methodology	Atif M. Memon	Automatically Repairing Event Sequence-based GUI Test Suites for Regression Testing	2008	10.1145/1416563.1416564
Proceedings of FORTE 2008	Farn Wang and Chih-Hong Cheng	Program Repair Suggestions From Graphical State-Transition Specifications	2008	10.1007/978-3-540-68855-6_12
PhD thesis. University of Birmingham	Andrea Arcuri	Automatic Software Generation and Improvement Through Search Based Techniques	2009	NOT_FOUND
Proceedings of the International Conference on Automated Software Engineering	Valentin Dallmeier, Andreas Zeller, and Bertrand Meyer	Generating Fixes From Object Behavior Anomalies	2009	10.1109/ase.2009.15
Proceedings of the 24th IEEE/ACM International Conference on Automated Software Engineering	Brett Daniel, Vilas Jagannath, Danny Dig, and Darko Marinov	ReAssert: Suggesting Repairs for Broken Unit Tests	2009	10.1109/ase.2009.17
Proceedings of the 11th Annual Conference on Genetic and Evolutionary Computation	S. Forrest, T.V. Nguyen, W. Weimer, and C. Le Goues	A Genetic Programming Approach to Automated Software Repair	2009	10.1145/1569901.1570031
ICPC	Dennis Jeffrey, Min Feng, Neelam Gupta, and Rajiv Gupta	BugFix: a Learning-based Tool to Assist Developers in Fixing Bugs	2009	10.1109/icpc.2009.5090029
International Symposium on Theoretical Aspects of Software Engineering	Yuhua Qi, Xiaoguang Mao, and Yan Lei	Program Repair As Sound Optimization of Broken Programs	2009	10.1109/tase.2009.61
Proceedings of the International Conference on Software Engineering	W. Weimer, T. Nguyen, C. Le Goues, and S. Forrest	Automatically Finding Patches Using Genetic Programming	2009	NOT_FOUND
7th joint meeting of the European Software engineering Conference and the ACM SIGSOFT Symposium on The Foundations of Software Engineering	Yingfei Xiong, Zhenjiang Hu, Haiyan Zhao, Hui Song, Masato Takeichi, and Hong Mei	Supporting Automatic Model Inconsistency Fixing	2009	10.1145/1595696.1595757
Proceedings of the International Conference on Software Testing, Verification and Validation	V. Debroy and W.E. Wong	Using Mutation to Automatically Suggest Fixes for Faulty Programs	2010	10.1109/icst.2010.66
Proceedings of the 12th Annual Conference on Genetic and Evolutionary Computation	Ethan Fast, Claire Le Goues, Stephanie Forrest, and Westley Weimer	Designing Better Fitness Functions for Automated Program Repair	2010	10.1145/1830483.1830654
Formal Methods for Industrial Critical Systems	Christian Kern and Javier Esparza	Automatic Error Correction of Java Programs	2010	10.1007/978-3-642-15898-8_5
PhD thesis. The Unversity of New Mexico	Thanh V. Nguyen	Automating Program Verification and Repair Using Invariant Analysis and Test Input Generation	2010	NOT_FOUND
Proceedings of the IEEE/ACM International Conference on Automated Software Engineering	E. Schulte, S. Forrest, and W. Weimer	Automated Program Repair Through the Evolution of Assembly Code	2010	10.1145/1858996.1859059
Proceedings of the 22nd International Conference on Advanced Information Systems Engineering	Marcos Aurélio Almeida da Silva, Alix Mougenot, Xavier Blanc, and Reda Bendraou	Towards Automated Inconsistency Handling in Design Models	2010	10.1007/978-3-642-13094-6_28
Proceedings of the International Symposium on Software Testing and Analysis	Yi Wei, Yu Pei, Carlo A. Furia, Lucas S. Silva, Stefan Buchholz, Bertrand Meyer, and Andreas Zeller	Automated Fixing of Programs with Contracts	2010	10.1145/1831708.1831716
Communications of the ACM	Westley Weimer, Stephanie Forrest, Claire Le Goues, and ThanhVu Nguyen	Automatic Program Repair with Evolutionary Computation	2010	10.1145/1735223.1735249
Proceedings of the 13th Annual Conference on Genetic and Evolutionary Computation	T. Ackling, B. Alexander, and I. Grunert	Evolving Patches for Software Repair	2011	10.1145/2001576.2001768
Applied Soft Computing	Andrea Arcuri	Evolutionary Repair of Faulty Software	2011	10.1016/j.asoc.2011.01.023
Proceedings of the International Conference on Tools and Algorithms for the Construction and Analysis of Systems	Divya Gopinath, Muhammad Zubair Malik, and Sarfraz Khurshid	Specification-based Program Repair Using SAT	2011	10.1007/978-3-642-19835-9_15
Proceedings of the 32nd ACM SIGPLAN Conference on Programming Language Design and Implementation	G. Jin, L. Song, W. Zhang, S. Lu, and B. Liblit	Automated Atomicity-violation Fixing	2011	10.1145/1993316.1993544
Formal Methods, Foundations and Applications	Sara Kalvala and Richard Warburton	A Formal Approach to Fixing Bugs	2011	10.1007/978-3-642-25032-3_12
Formal Methods in Computer-Aided Design (FMCAD), 2011	Robert Könighofer and Roderick Bloem	Automated Error Localization and Correction for Imperative Programs	2011	NOT_FOUND
Proceedings of the International Conference on Software Testing, Verification and Validation	N. Lazaar, A. Gotlieb, and Y. Lebbah	A Framework for the Automatic Correction of Constraint Programs	2011	10.1109/icst.2011.41
International Conference on Software Testing, Verification and Validation (ICST)	M.Z. Malik, J.H. Siddiqi, and S. Khurshid	Constraint-Based Program Debugging Using Data Structure Repair	2011	10.1109/icst.2011.65
Tech. rep. arXiv:1102.1059v2	Yu Pei, Yi Wei, Carlo A Furia, Martin Nordio, and Bertrand Meyer	Code-Based Automated Program Fixing	2011	10.1109/ase.2011.6100080
Proceedings of the International Symposium on Software Testing and Analysis	Zachary P. Fry, Bryan Landau, and Westley Weimer	A Human Study of Patch Maintainability	2012	10.1145/2338965.2336775
Proceedings of the International Conference on Software Engineering	C. Le Goues, M. Dewey-Vogt, S. Forrest, and W. Weimer	A Systematic Study of Automated Program Repair: Fixing 55 Out of 105 Bugs for $8 Each	2012	10.1109/icse.2012.6227211
IEEE Transactions on Software Engineering	Claire Le Goues, ThanhVu Nguyen, Stephanie Forrest, and Westley Weimer	Gen-Prog: a Generic Method for Automatic Software Repair	2012	NOT_FOUND
Proceedings of the 2012 International Conference on Software Engineering	Peng Liu and Charles Zhang	Axis: Automatically Fixing Atomicity Violations Through Solving Control Constraints	2012	10.1109/icse.2012.6227184
Proceedings of the 27th ACM International Conference on Object Oriented Programming Systems Languages and Applications	Francesco Logozzo and Tom Ball	Modular and Verified Automatic Program Repair	2012	10.1145/2398857.2384626
Science China Information Sciences	YuHua Qi, XiaoGuang Mao, YanJun Wen, ZiYing Dai, and Bin Gu	More Efficient Automatic Repair of Large-scale Programs Using Weak Recompilation	2012	10.1007/s11432-012-4741-1
17th IEEE European Test Symposium	Urmas Repinski, Hanno Hantson, Maksim Jenihhin, Jaan Raik, Raimund Ubar, Giuseppe Di Guglielmo, Graziano Pravadelli, and Franco Fummi	Combining dynamic slicing and mutation operators for ESL correction	2012	10.1109/ets.2012.6233020
Proceedings of ICSE	Hesam Samimi, Max Schäfer, Shay Artzi, Todd D. Millstein, Frank Tip, and Laurie J. Hendren	Automated Repair of HTML Generation Errors in PHP Applications Using String Constraint Solving	2012	10.1109/icse.2012.6227186
IEEE 13th International Working Conference on Source Code Analysis and Manipulation, SCAM 2013	Vipin Balachandran	Fix-it: An extensible code auto-fix component in review bot	2013	10.1109/scam.2013.6648198
Proceedings of the International Conference on Software Engineering	Zack Coker and Munawar Hafiz	Program Transformations to Fix C Integers	2013	10.1109/icse.2013.6606625
Proceedings of CASCON	Youry Khmelevsky, Martin C Rinard, and Stelios Sidiroglou-Douskos	A Source-to-source Transformation Tool for Error Fixing	2013	NOT_FOUND
Proceedings of ICSE	Dongsun Kim, Jaechang Nam, Jaewoo Song, and Sunghun Kim	Automatic Patch Generation Learned From Human-Written Patches	2013	NOT_FOUND
PhD thesis. University of Virgina	Claire Le Goues	Automatic Program Repair Using Genetic Programming	2013	NOT_FOUND
Software Quality Journal	Claire Le Goues, Stephanie Forrest, and Westley Weimer	Current Challenges in Automatic Software Repair	2013	10.1007/s11219-013-9208-0
International Conference on Software Testing, Verification and Validation	Maurizio Leotta, Diego Clerissi, Filippo Ricca, and Cristiano Spadaro	Repairing Selenium Test Cases: an Industrial Case Study about Web Page Element Localization	2013	10.1109/icst.2013.73
Proceedings of the International Conference on Software Testing, Verification and Validation (ICST)	Chen Liu, Jinqiu Yang, Lin Tan, and Munawar Hafiz	R2Fix: Automatically Generating Bug Fixes From Bug Reports	2013	10.1109/icst.2013.24
Semantics, Abstract Interpretation, and Reasoning About Programs: Essays Dedicated to David A. Schmidt on the Occasion of His Sixtieth Birthday	Francesco Logozzo and Matthieu Martel	Automatic Repair of Overflowing Expressions with Abstract Interpretation	2013	10.4204/eptcs.129.21
"Research Report Dagstuhl Seminar 13061 ""Fault Prediction, Localization, and Repair"". Schloss Dagstuhl - Leibniz Center for Informatics"	Martin Monperrus and Benoit Baudry	Two Flavors in Automated Software Repair: Rigid Repair and Plastic Repair	2013	NOT_FOUND
Proceedings of the International Conference on Software Engineering	Hoang Duong Thien Nguyen, Dawei Qi, Abhik Roychoudhury, and Satish Chandra	SemFix: Program Repair via Semantic Analysis	2013	10.1109/icse.2013.6606623
Proceedings of ICSM	Y. Qi, X. Mao, and Y. Lei	Efficient Automated Program Repair Through Fault-Recorded Testing Prioritization	2013	10.1109/icsm.2013.29
ACM SIGPLAN Notices	Rishabh Singh, Sumit Gulwani, and Armando Solar-Lezama	Automated Feedback Generation for Introductory Programming Assignments	2013	10.1145/2499370.2462195
Proceedings of the Network and Distributed System Security Symposium	Sooel Son, Kathryn S McKinley, and Vitaly Shmatikov	Fix Me Up: Repairing Access-Control Bugs in Web Applications	2013	NOT_FOUND
International Conference on Automated Software Engineering	Westley Weimer, Zachary P. Fry, and Stephanie Forrest	Leveraging program equivalence for adaptive program repair: Models and first results	2013	10.1109/ase.2013.6693094
Proceedings of the 6th International Workshop on Constraints in Software Testing, Verification, and Analysis (CSTVA 2014)	Favio Demarco, Jifeng Xuan, Daniel Le Berre, and Martin Monperrus	Automatic Repair of Buggy If Conditions and Missing Preconditions with SMT	2014	10.1145/2593735.2593740
Proceedings of the 36th International Conference on Software Engineering	Divya Gopinath, Sarfraz Khurshid, Diptikalyan Saha, and Satish Chandra	Data-guided Repair of Selection Statements	2014	10.1145/2568225.2568303
Proceedings of the 2014 International Symposium on Software Testing and Analysis (ISSTA’14)	René Just, Darioush Jalali, and Michael D. Ernst	Defects4J: A Database of Existing Faults to Enable Controlled Testing Studies for Java Programs	2014	10.1145/2610384.2628055
Proceedings of the International Conference on Software Engineering	Shalini Kaleeswaran, Varun Tulsian, Aditya Kanade, and Alessandro Orso	Minthint: Automated Synthesis of Repair Hints	2014	10.1145/2568225.2568258
Proceedings of the 2014 International Symposium on Software Testing and Analysis	Yiyan Lin and Sandeep Kulkarni	Automatic Repair for Multi-threaded Programs with Deadlock/Livelock Using Maximum Satisfiability	2014	10.1145/2610384.2610398
ACM SIGPLAN Notices	Fan Long, Stelios Sidiroglou-Douskos, Deokhwan Kim, and Martin Rinard	Sound Input Filter Generation for Integer Overflow Errors	2014	10.1145/2578855.2535888
PhD thesis. Université de Lille	Matias Martinez	Extraction and Analysis of Knowledge for Automatic Software Repair	2014	NOT_FOUND
ICSE - 36th IEEE International Conference on Software Engineering	Matias Martinez, Westley Weimer, and Martin Monperrus	Do the Fix Ingredients Already Exist? An Empirical Inquiry into the Redundancy Assumptions of Program Repair Approaches	2014	10.1145/2591062.2591114
International Conference on Software Engineering	Martin Monperrus	"A Critical Review of ""Automatic Patch Generation Learned from Human-Written Patches"": Essay on the Problem Statement and the Evaluation of Automatic Software Repair"	2014	10.1145/2568225.2568324
Proceedings of the 36th International Conference on Software Engineering	Frolin S Ocariza Jr, Karthik Pattabiraman, and Ali Mesbah	Vejovis: suggesting fixes for JavaScript faults	2014	10.1145/2568225.2568257
Proceedings of the 36th International Conference on Software Engineering	Yuhua Qi, Xiaoguang Mao, Yan Lei, Ziying Dai, and Chengsong Wang	The Strength of Random Search on Automated Program Repair	2014	NOT_FOUND
International Static Analysis Symposium	Roopsha Samanta, Oswaldo Olivo, and E Allen Emerson	Cost-aware Automatic Program Repair	2014	NOT_FOUND
International Conference on Dependable Systems and Networks	Alex Shaw, Dusten Doggett, and Munawar Hafiz	Automatically Fixing C Buffer Overflows Using Program Transformations	2014	10.1109/dsn.2014.25
Proceedings of the 22nd ACM SIGSOFT International Symposium on Foundations of Software Engineering	Yida Tao, Jindae Kim, Sunghun Kim, and Chang Xu	Automatically Generated Patches As Debugging Aids: a Human Study	2014	NOT_FOUND
Detection of Intrusions and Malware, and Vulnerability Assessment	Tielei Wang, Chengyu Song, and Wenke Lee	Diagnosis and Emergency Patch Generation for Integer Overflow Exploits	2014	NOT_FOUND
IEEE Transactions on Software Engineering	Andreas Zeller, Yi Wei, Bertrand Meyer, Martin Nordio, Carlo A. Furia, and Yu Pei	Automated Fixing of Programs with Contracts	2014	10.1109/tse.2014.2312918
PhD thesis. Université de Lille	Benoit Cornu	Automatic Analysis and Repair of Exception Bugs for Java Programs	2015	NOT_FOUND
Foundations of Software Engineering	Aritra Dhar, Rahul Purandare, Mohan Dhawan, and Suresh Rangaswamy	CLOTHO: Saving Programs from Malformed Strings and Incorrect String-handling	2015	10.1145/2786805.2786877
Tech. rep. hal-01162221. HAL	Thomas Durieux, Matias Martinez, Martin Monperrus, Romain Sommerard, and Jifeng Xuan	Automatic Repair of Real Bugs: An Experience Report on the Defects4J Dataset	2015	NOT_FOUND
Proceedings of the 37th International Conference on Software Engineering	Qing Gao, Yingfei Xiong, Yaqing Mi, Lu Zhang, Weikun Yang, Zhaoping Zhou, Bing Xie, and Hong Mei	Safe Memory-leak Fixing for C Programs	2015	10.1109/icse.2015.64
Proceedings of the 30th IEEE/ACM International Conference on Automated Software Engineering	Qing Gao, Hansheng Zhang, Jie Wang, Yingfei Xiong, Lu Zhang, and Hong Mei	Fixing Recurring Crash Bugs via Analyzing Q&A Sites	2015	10.1109/ase.2015.81
IEEE Transactions on Software Engineering	Z. Gao, Z. Chen, Y. Zou, and A. Memon	SITAR: GUI Test Script Repair	2015	NOT_FOUND
37th International Conference on Software Engineering (ICSE), track on New Ideas and Emerging Results (NIER)	Maria Gomez, Matias Martinez, Martin Monperrus, and Romain Rouvoy	When App Stores Listen to the Crowd to Fight Bugs in the Wild	2015	NOT_FOUND
Proceedings of the International Conference on Automated Software Engineering	Yalin Ke, Kathryn T. Stolee, Claire Le Goues, and Yuriy Brun	Repairing Programs with Semantic Code Search	2015	10.1109/ase.2015.60
International Conference on Computer Aided Verification	Etienne Kneuss, Manos Koukoutos, and Viktor Kuncak	Deductive Program Repair	2015	10.1007/978-3-319-21668-3_13
Technical Report hal-01144026. University of Lille	Sebastian Lamelas and Martin Monperrus	Automatic Repair of Infinite Loops	2015	NOT_FOUND
Proceedings of the IEEE International Symposium on Software Reliability Engineering	Xuan-Bach D. Le, Tien-Duy B. Le, and David Lo	Should fixing these failures be delegated to automated program repair?	2015	NOT_FOUND
IEEE Transactions on Software Engineering (TSE)	Claire Le Goues, Neal Holtschulte, Edward K. Smith, Yuriy Brun, Premkumar Devanbu, Stephanie Forrest, and Westley Weimer	The ManyBugs and IntroClass Benchmarks for Automated Repair of C Programs	2015	NOT_FOUND
Proceedings of ESEC/FSE	Fan Long and Martin C. Rinard	Staged Program Repair with Condition Synthesis	2015	10.1145/2786805.2786811
Empirical Software Engineering	Matias Martinez and Martin Monperrus	Mining Software Repair Models for Reasoning on the Search Space of Automated Program Fixing	2015	NOT_FOUND
Proceedings of the 37th International Conference on Software Engineering	Sergey Mechtaev, Jooyong Yi, and Abhik Roychoudhury	DirectFix: Looking for Simple Program Repairs	2015	10.1109/icse.2015.63
International Conference on Computer Safety, Reliability & Security (SAFECOMP’15)	P. Muntean, V. K. Kommanapalli, A. Ibing, and C. Eckert	Automated Generation of Buffer Overflows Quick Fixes Using Symbolic Execution and SMT	2015	10.1007/978-3-319-24255-2_32
2015 IEEE/ACM 37th IEEE International Conference on Software Engineering	Adrian Nistor, Po-Chun Chang, Cosmin Radoi, and Shan Lu	Caramel: Detecting and fixing performance problems that have non-intrusive fixes	2015	10.1109/icse.2015.100
Software: Practice and Experience	Renaud Pawlak, Martin Monperrus, Nicolas Petitprez, Carlos Noguera, and Lionel Seinturier	Spoon: A Library for Implementing Analyses and Transformations of Java Source Code	2015	NOT_FOUND
Proceedings of ISSTA	Zichao Qi, Fan Long, Sara Achour, and Martin Rinard	An Analysis of Patch Plausibility and Correctness for Generate-And-Validate Patch Generation Systems	2015	10.1145/2771783.2771791
Proceedings of the 10th Joint Meeting of the European Software Engineering Conference and ACM SIGSOFT Symposium on the Foundations of Software Engineering (ESEC/FSE)	Edward K. Smith, Earl Barr, Claire Le Goues, and Yuriy Brun	Is the Cure Worse Than the Disease? Overfitting in Automated Program Repair	2015	10.1145/2786805.2786825
Proceedings of ICSE	Shin Hwei Tan and Abhik Roychoudhury	Relifix: Automated Repair of Software Regressions	2015	10.1109/icse.2015.65
IEEE Transactions on Software Engineering	Yingfei Xiong, Hansheng Zhang, Arnaud Hubaux, Steven She, Jie Wang, and Krzysztof Czarnecki	Range Fixes: Interactive Error Resolution for Software Configuration	2015	10.1109/tse.2014.2383381
arXiv abs/1603.06129	Sahil Bhatia and Rishabh Singh	Automated Correction for Syntax Errors in Programming Assignments using Recurrent Neural Networks	2016	NOT_FOUND
International Conference on Computer Aided Verification	Loris DAntoni, Roopsha Samanta, and Rishabh Singh	Qlose: Program Repair with Quantitative Objectives	2016	NOT_FOUND
11th International Workshop in Automation of Software Test (AST 2016)	Thomas Durieux and Martin Monperrus	DynaMoth: Dynamic Code Synthesis for Automatic Program Repair	2016	NOT_FOUND
Research Report hal-01272126. Universite Lille 1	Thomas Durieux and Martin Monperrus	IntroClassJava: A Benchmark of 297 Small and Buggy Java Programs	2016	NOT_FOUND
PhD thesis. University of Texas	Divya Gopinath	Systematic techniques for more effective fault localization and program repair	2016	NOT_FOUND
arXiv preprint arXiv:1603.03165	Sumit Gulwani, Ivan Radiek, and Florian Zuleger	Automated Clustering and Program Repair for Introductory Programming Assignments	2016	NOT_FOUND
Proceedings of the 2016 24th ACM SIGSOFT International Symposium on Foundations of Software Engineering	Mouna Hammoudi, Gregg Rothermel, and Andrea Stocco	Waterfall: An incremental approach for repairing record-replay tests of web applications	2016	NOT_FOUND
2016 IEEE 40th Annual Computer Software and Applications Conference (COMPSAC)	Tao Ji, Liqian Chen, Xiaoguang Mao, and Xin Yi	Automated Program Repair by Using Similar Code Containing Fix Ingredients	2016	10.1109/compsac.2016.69
Journal of Systems and Software	Mingyue Jiang, Tsong Yueh Chen, Fei-Ching Kuo, Dave Towey, and Zuohua Ding	A Metamorphic Testing Approach for Supporting Program Repair without the Need for a Test Oracle	2016	NOT_FOUND
Proceedings of the 23rd International Conference on Software Analysis, Evolution, and Reengineering (SANER)	X. B. D. Le, D. Lo, and C. L. Goues	History Driven Program Repair	2016	10.1109/saner.2016.76
2016 IEEE International Conference on Software Maintenance and Evolution (ICSME)	X. D. Le, D. Lo, and C. Le Goues	Empirical Study on Synthesis Engines for Semantics-Based Program Repair	2016	10.1109/icsme.2016.68
IEEE International Conference on Software Maintenance and Evolution	Xuan-Bach D Le, Quang Loc Le, David Lo, and Claire Le Goues	Enhancing automated program repair with deductive verification	2016	NOT_FOUND
Proceedings of the 2016 24th ACM SIGSOFT International Symposium on Foundations of Software Engineering	Haopeng Liu, Yuxi Chen, and Shan Lu	Understanding and Generating High Quality Patches for Concurrency bugs	2016	NOT_FOUND
Proceedings of the Symposium on Principles of Programming Languages	Fan Long and Martin C. Rinard	Prophet: Automatic Patch Generation via Learning From Successful Patches	2016	NOT_FOUND
Proceedings of the ACM on Asia Conference on Computer and Communications Security	Siqi Ma, David Lo, Teng Li, and Robert H Deng	Cdrep: Automatic repair of cryptographic misuses in android applications	2016	NOT_FOUND
Proceedings of ISSTA, Demonstration Track	Matias Martinez and Martin Monperrus	ASTOR: A Program Repair Library for Java	2016	NOT_FOUND
Proceedings of the 38th International Conference on Software Engineering	Sergey Mechtaev, Jooyong Yi, and Abhik Roychoudhury	Angelix: Scalable Multiline Program Patch Synthesis via Symbolic Analysis	2016	NOT_FOUND
Proceedings of the 8th International Symposium on Search Based Software Engineering	Vinicius Oliveira, Eduardo Souza, Claire Le Goues, and Celso G. Camilo	Improved Crossover Operators for Genetic Programming for Program Repair	2016	NOT_FOUND
Companion Proceedings of the 2016 ACM SIGPLAN International Conference on Systems, Programming, Languages and Applications: Software for Humanity	Yewen Pu, Karthik Narasimhan, Armando Solar-Lezama, and Regina Barzilay	sk_p: a neural program corrector for MOOCs	2016	NOT_FOUND
International Symposium on Formal Methods	Bat-Chen Rothenberg and Orna Grumberg	Sound and complete mutation-based program repair	2016	10.1007/978-3-319-48989-6_36
2016 46th Annual IEEE/IFIP International Conference on Dependable Systems and Networks Workshop (DSN-W)	W. Weimer, S. Forrest, M. Kim, C. L. Goues, and P. Hurley	Trusted Software Repair for System Resiliency	2016	10.1109/dsn-w.2016.64
Proceedings of the 32Nd IEEE/ACM International Conference on Automated Software Engineering	Liushan Chen, Yu Pei, and Carlo A. Furia	Contract-based Program Repair Without the Contracts	2017	10.1109/ase.2017.8115674
Proceedings of the 32nd IEEE/ACM International Conference on Automated Software Engineering	Xi Cheng, Min Zhou, Xiaoyu Song, Ming Gu, and Jiaguang Sun	IntPTI: Automatic integer error repair with proper-type inference	2017	NOT_FOUND
arXiv preprint arXiv:1710.11054	Jacob Devlin, Jonathan Uesato, Rishabh Singh, and Pushmeet Kohli	Semantic Code Repair using Neuro-Symbolic Transformation Networks	2017	NOT_FOUND
IEEE International Conference on Software Analysis, Evolution and Reengineering	Thomas Durieux, Benoit Cornu, Lionel Seinturier, and Martin Monperrus	Dynamic Patch Generation for Null Pointer Exceptions Using Metaprogramming	2017	10.1109/saner.2017.7884635
Proceedings of the 39th International Conference on Software Engineering: New Ideas and Emerging Results Track	Thomas Durieux, Youssef Hamadi, and Martin Monperrus	Production-Driven Patch Generation	2017	10.1109/icse-nier.2017.8
IEEE Transactions on Software Engineering	Luca Gazzola, Daniela Micucci, and Leonardo Mariani	Automatic software repair: A survey	2017	NOT_FOUND
