conference	authors	title	year	DOI
International Conference on Software Engineering - Software Engineering in Practice	Alexandru Marginean, Johannes Bader, Satish Chandra, Yue Jia Mark Harman, Ke Mao, Alexander Mols, and Andrew Scott	SapFix: Automated End-to-End Repair at Scale	2019	10.1109/icse-seip.2019.00039
Journal of Systems and Software, Elsevier	Matias Martinez and Martin Monperrus	Astor: Exploring the Design Space of Generate-and-Validate Program Repair beyond GenProg	2019	10.1016/j.jss.2019.01.069
Journal of Systems and Software, Elsevier	Matias Martinez and Martin Monperrus	Astor: Exploring the Design Space of Generate-and-Validate Program Repair beyond GenProg	2019	10.1016/j.jss.2019.01.069
Proceedings of ESEC/FSE	Ali Mesbah, Andrew Rice, Emily Johnston, Nick Glorioso, and Eddie Aftandilian	DeepDelta: learning to repair compilation errors	2019	10.1145/3338906.3340455
2019 IEEE International Symposium on Software Reliability Engineering Workshops (ISSREW)	Mahmoud Mohammadi, Bill Chu, and Heather Richter Lipford	Automated Repair of Cross-Site Scripting Vulnerabilities through Unit Testing	2019	10.1109/issrew.2019.00098
arXiv preprint arXiv:1907.06205	Venkatesh Theru Mohan and Ali Jannesari	Automatic Repair and Type Binding of Undeclared Variables using Neural Networks	2019	NOT_FOUND
Proceedings of IEEE/ACM International Workshop on Bots in Software Engineering (BotSE)	Martin Monperrus	Explainable Software Bot Contributions: Case Study of Automated Bug Fixes	2019	10.1109/botse.2019.00010
Ubiquity	Martin Monperrus, Simon Urli, Thomas Durieux, Martin Martinez, Benoit Baudry, and Lionel Seinturier	Repairnator patches programs automatically	2019	10.1145/3349589
IEEE Transactions on Software Engineering	Paul Muntean, Martin Monperrus, Hao Sun, Jens Grossklags, and Claudia Eckert	IntRepair: Informed Repairing of Integer Overflows	2019	NOT_FOUND
Proceedings of the International Conference on Software Engineering	Seemanta Saha, Ripon K Saha, and Mukul R Prasad	Harnessing evolution for multi-hunk program repair	2019	10.1109/icse.2019.00020
arXiv preprint arXiv:1902.06111	Andrew Scott, Johannes Bader, and Satish Chandra	Getafix: Learning to Fix Bugs Automatically	2019	10.1145/3360585
Proceedings of the 2019 27th ACM Joint Meeting on European Software Engineering Conference and Symposium on the Foundations of Software Engineering	August Shi, Wing Lam, Reed Oei, Tao Xie, and Darko Marinov	iFixFlakies: a framework for automatically fixing order-dependent flaky tests	2019	10.1145/3338906.3338925
Proceedings of the Working Conference on Software Visualization	Yuya Tomida, Yoshiki Higo, Shinsuke Matsumoto, and Shinji Kusumoto	Visualizing Code Genealogy: How Code is Evolutionarily Fixed in Program Repair?	2019	10.1109/vissoft.2019.00011
Proceedings of the 1st International Workshop on Bots in Software Engineering	Rijnard van Tonder and Claire Le Goues	Towards s/engineer/bot: principles for program repair bots	2019	10.1109/botse.2019.00019
First International Conference on HCI for Cybersecurity, Privacy and Trust	J Tyler, Gene M Alarcon, Charles Walter, Rose Gamble, A Sarah, August Capiola, and Marc D Pfahler	Trust in Automated Software Repair	2019	10.1007/978-3-030-22351-9_31
Proceedings of the 41st International Conference on Software Engineering: Companion Proceedings	Kaiyuan Wang, Allison Sullivan, and Sarfraz Khurshid	ARepair: a repair framework for alloy	2019	10.1109/icse-companion.2019.00049
arXiv preprint arXiv:1906.03447	Shangwen Wang, Ming Wen, Liqian Chen, Xin Yi, and Xiaoguang Mao	How Different Is It Between Machine-Generated and Developer-Provided Patches? An Empirical Study on The Correct Patches Generated by Automated Program Repair Techniques	2019	10.1109/esem.2019.8870172
Journal of Systems and Software	Weichao Wang, Zhaopeng Menga, Zan Wanga, Shuang Liua, and Jianye Haoa	Loop-Fix: An Approach to Automatic Repair of Buggy Loops	2019	NOT_FOUND
Proceedings of the 6th International Workshop on Genetic Improvement	Qi Xin and Steven P Reiss	Better code search and reuse for better program repair	2019	10.1109/gi.2019.00012
arXiv preprint 1903.04583	Qi Xin and Steven P Reiss	Revisiting ssFix for Better Program Repair	2019	NOT_FOUND
International Workshop on Intelligent Bug Fixing	Xiaoqian Xing and Katsuhisa Maruyama	Automatic Software Merging using Automated Program Repair	2019	10.1109/ibf.2019.8665493
Proceedings of ICSE	Xuezheng Xu, Yulei Sui, Hua Yan, and Jingling Xue	VFix: Value-Flow-Guided Precise Program Repair for Null Pointer Dereferences	2019	10.1109/icse.2019.00063
Proceedings of the ACM on Programming Languages	Xin Yi, Liqian Chen, Xiaoguang Mao, and Tao Ji	Efficient automated repair of high floating-point errors in numerical libraries	2019	10.1145/3290369
arXiv preprint arXiv:1912.05823	Xiao Liang Yu, Omar Al-Bataineh, David Lo, and Abhik Roychoudhury	Smart Contract Repair	2019	NOT_FOUND
Tech. rep. 1907.09282. arXiv	Zhongxing Yu, Matias Martinez, Tegawendé F. Bissyandé, and Martin Monperrus	Learning the Relation between Code Features and Code Transforms with Structured Prediction	2019	NOT_FOUND
Proceedings of the Genetic and Evolutionary Computation Conference	Yuan Yuan and Wolfgang Banzhaf	A hybrid evolutionary system for automatic software repair	2019	10.1145/3321707.3321830
Systems	Gene M Alarcon, Charles Walter, Anthony M Gibson, Rose F Gamble, August Capiola, Sarah A Jessup, and Tyler J Ryan	Would You Fix This Code for Me? Effects of Repair Source and Commenting on Trust in Code Repair	2020	10.3390/systems8010008
arXiv preprint arXiv:2002.03968	Aldeida Aleti and Matias Martinez	E-APR: Mapping the Effectiveness of Automated Program Repair	2020	NOT_FOUND
arXiv preprint arXiv:2012.11060	Abdulaziz Alhefdhi, Hoa Khanh Dam, Xuan-Bach D Le, and Aditya Ghose	Adversarial Patch Generation for Automatic Program Repair	2020	NOT_FOUND
2020 35th IEEE/ACM International Conference on Automated Software Engineering (ASE)	Samuel Benton, Xia Li, Yiling Lou, and Lingming Zhang	On the effectiveness of unified debugging: An extensive study on 16 program repair systems	2020	10.1145/3324884.3416566
arXiv preprint arXiv:2003.03201	Bhargav Nagaraja Bhatt and Carlo A Furia	Automated Repair of Resource Leaks in Android Applications	2020	NOT_FOUND
Proceedings of ICST	Marcel Böhme, Charaka Geethal, and Van-Thuan Pham	Human-In-The-Loop Automatic Program Repair	2020	10.1109/icst46399.2020.00036
2020 6th International Symposium on System and Software Reliability (ISSSR)	Heling Cao, YangXia Meng, Jianshu Shi, Lei Li, Tiaoli Liao, and Chenyang Zhao	A Survey on Automatic Bug Fixing	2020	10.1109/isssr51244.2020.00029
Proceedings of SANER	Antônio Carvalho, Welder Luz, Diego Marcilio, Rodrigo Bonifécio, Gustavo Pinto, and Edna Dias Canedo	C-3PR: A Bot for Fixing Static Analysis Violations via Pull Requests	2020	10.1109/saner48275.2020.9054842
arXiv preprint arXiv:2007.11449	Lingchao Chen and Lingming Zhang	Fast and Precise On-the-fly Patch Validation for All	2020	NOT_FOUND
IEEE Transactions on Software Engineering	Liushan Chen, Yu Pei, and Carlo Alberto Furia	Contract-Based Program Repair without The Contracts: An Extended Study	2020	NOT_FOUND
PhD thesis. Carnegie Mellon University	Zack Coker	Automatic Repair of Framework Applications	2020	NOT_FOUND
IEEE 2nd International Workshop on Intelligent Bug Fixing (IBF)	V. Csuvik, D. Horváth, F. Horváth, and L. Vidács	Utilizing Source Code Embeddings to Identify Correct Patches	2020	10.1109/ibf50092.2020.9034714
Proceedings of ICLR	Elizabeth Dinella, Hanjun Dai, Ziyang Li, Mayur Naik, Le Song, and Ke Wang	Hoppity: learning graph transformations to detect and fix bugs in programs	2020	NOT_FOUND
arXiv preprint arXiv:2008.10707	Yangruibo Ding, Baishakhi Ray, Premkumar Devanbu, and Vincent J Hellendoorn	Patching as Translation: the Data and the Metaphor	2020	10.1145/3324884.3416587
IEEE Congress on Evolutionary Computation	Piotr Dziurzanski, Simos Gerasimou, Dimitris Kolovos, and Nicholas Matragkas	Empirical Analysis of 1-edit Degree Patches in Syntax-Based Automatic Program Repair	2020	10.1109/cec48606.2020.9185913
Tech. rep. 2007.06986. arXiv	Khashayar Etemadi, Niloofar Tarighat, Siddharth Yadav, Matias Martinez, and Martin Monperrus	Longitudinal Analysis of the Applicability of Program Repair on Past Commits	2020	NOT_FOUND
PhD thesis. Università Degli Studi Di Milano-Bicocca	Davide Ginelli	Understanding and Improving Automatic Program Repair: A Study of Code-removal Patches and a New Exception-driven Fault Localization Approach	2020	NOT_FOUND
arXiv preprint arXiv:2012.06264	Davide Ginelli, Matias Martinez, Leonardo Mariani, and Martin Monperrus	A Comprehensive Study of Code-removal Patches in Automated Program Repair	2020	NOT_FOUND
Advances in Neural Information Processing Systems	Kavi Gupta, Peter Ebert Christensen, Xinyun Chen, and Dawn Song	Synthesize, execute and debug: Learning to repair for neural program synthesis	2020	NOT_FOUND
Proceedings of the 11th ACM Symposium on Cloud Computing	Jingzhu He, Ting Dai, Xiaohui Gu, and Guoliang Jin	HangFix: automatically fixing software hang bugs for production cloud systems	2020	10.1145/3419111.3421288
Proceedings of ICSE	Seongjoon Hong, Junhee Lee, Jeongsoo Lee, and Hakjoo Oh	SAVER: Scalable, Precise, and Safe Memory-Error Repair	2020	10.1145/3377811.3380323
arXiv preprint arXiv:2001.11367	Shan Huang, Xiao Zhou, and Sang Chin	A Study of Pyramid Structure for Code Correction	2020	NOT_FOUND
IEEE Transactions on Reliability	Mingyue Jiang, Tsong Yueh Chen, Zhi Quan Zhou, and Zuohua Ding	Input Test Suites for Program Repair: A Novel Construction Method Based on Metamorphic Relations	2020	NOT_FOUND
PhD thesis. University of Luxembourg	Anil Koyuncu	Boosting Automated Program Repair for Adoption By Practitioners	2020	NOT_FOUND
arXiv preprint arXiv:2011.13280	Anil Koyuncu, Tegawendé F Bissyandé, Jacques Klein, and Yves Le Traon	FlexiRepair: Transparent Program Repair with Generic Patches	2020	NOT_FOUND
Empirical Software Engineering Journal, Springer Verlag	Anil Koyuncu, Kui Liu, Tegawendé F. Bissyandé, Dongsun Kim, Jacques Klein, Martin Monperrus, and Yves Le Traon	FixMiner: Mining Relevant Fix Patterns for Automated Program Repair	2020	10.1007/s10664-019-09780-z
Proceedings of the ACM/IEEE 42nd International Conference on Software Engineering	Yi Li, Shaohua Wang, and Tien N Nguyen	DLfix: Context-based code transformation learning for automated program repair	2020	10.1145/3377811.3380345
Proceedings of APSEC	Bo Lin, Shangwen Wang, Ming Wen, Zhang Zhang, Hongjun Wu, Yihao Qin, and Xiaoguang Mao	Understanding the Non-Repairability Factors of Automated Program Repair Techniques	2020	10.1109/apsec51365.2020.00015
Proceedings of ICSE	Kui Liu, Shangwen Wang, Anil Koyuncu, Kisub Kim, Tegawendé F Bissyandé, Dongsun Kim, Peng Wu, Jacques Klein, Xiaoguang Mao, and Yves Le Traon	On the Efficiency of Test Suite based Program Repair	2020	10.1145/3377811.3380338
Proceedings of ISSTA	Thibaud Lutellier, Hung Viet Pham, Lawrence Pang, Yitong Li, Moshi Wei, and Lin Tan	CoCoNuT: Combining Context-Aware Neural Translation Models using Ensemble for Program Repair	2020	10.1145/3395363.3397369
IEEE Transactions on Software Engineering	M. Motwani, M. Soto, Y. Brun, R. Just, and C. Le Goues	Quality of Automated Program Repair on Real-World Defects	2020	NOT_FOUND
arXiv preprint arXiv:2011.08340	Manish Motwani and Yuriy Brun	Automatically Repairing Programs Using Both Tests and Bug Reports	2020	NOT_FOUND
27th International Conference on Software Analysis, Evolution and Reengineering (SANER)	Kunihiro Noda, Yusuke Nemoto, Keisuke Hotta, Hideo Tanida, and Shinji Kikuchi	Experience Report: How Effective is Automated Program Repair for Industrial Software?	2020	10.1109/saner48275.2020.9054829
IEEE Transactions on Software Engineering	Minxue Pan, Tongtong Xu, Yu Pei, Zhong Li, Tian Zhang, and Xuandong Li	GUI-Guided Test Script Repair for Mobile Apps	2020	10.1109/tse.2020.3007664
PhD thesis. Technion Israel Institute of Technology, Israel	Bat-Chen Rothenberg	Formal Automated Program Repair	2020	NOT_FOUND
Proceedings of the 41st ACM SIGPLAN Conference on Programming Language Design and Implementation	Georgios Sakkas, Madeline Endres, Benjamin Cosman, Westley Weimer, and Ranjit Jhala	Type error feedback via analytic program repair	2020	NOT_FOUND
Proceedings of ASE	Haoye Tian, Kui Liu, Abdoul Kader Kaboreé, Anil Koyuncu, Li Li, Jacques Klein, and Tegawendé F Bissyandé	Evaluating representation learning of code changes for predicting patch correctness in program repair	2020	NOT_FOUND
arXiv preprint arXiv:2005.11040	Yuki Ueda, Takashi Ishio, Akinori Ihara, and Kenichi Matsumoto	DevReplay: Automatic Repair with Editable Fix Pattern	2020	NOT_FOUND
Proceedings of ASE	Shangwen Wang, Ming Wen, Bo Lin, Hongjun Wu, Yihao Qin, Deqing Zou, Xiaoguang Mao, and Hai Jin	Automated Patch Correctness Assessment: How Far are We?	2020	10.1145/3324884.3416590
Proceedings of the 28th International Conference on Program Comprehension	Liwei Wu, Fei Li, Youhua Wu, and Tao Zheng	GGF: A Graph-based Method for Programming Language Syntax Error Correction	2020	NOT_FOUND
IEEE Transactions on Software Engineering	Tongtong Xu, Liushan Chen, Yu Pei, Tian Zhang, Minxue Pan, and Carlo Alberto Furia	Restore: Retrospective fault localization enhancing automated program repair	2020	NOT_FOUND
IEEE 2nd International Workshop on Intelligent Bug Fixing (IBF)	Bo Yang and Jinqiu Yang	Exploring the Differences between Plausible and Correct Patches at Fine-Grained Level	2020	10.1109/ibf50092.2020.9034821
arXiv preprint arXiv:2005.10636	Michihiro Yasunaga and Percy Liang	Graph-based, Self-Supervised Program Repair from Diagnostic Feedback	2020	NOT_FOUND
IEEE Transactions on Software Engineering	Wang Yu, Fengjuan Gao, Linzhang Wang, Tingting Yu, Jianhua Zhao, and Xuandong Li	Automatic Detection, Validation and Repair of Race Conditions in Interrupt-Driven Embedded Software	2020	NOT_FOUND
ACM Trans. Softw. Eng. Methodol.	Yuan Yuan and Wolfgang Banzhaf	Toward Better Evolutionary Program Repair: An Integrated Approach	2020	10.1145/3360004
2020 IEEE 27th International Conference on Software Analysis, Evolution and Reengineering (SANER)	Yuyao Zhang, Siqi Ma, Juanru Li, Kailai Li, Surya Nepal, and Dawu Gu	Smartshield: Automatic smart contract protection made easy	2020	NOT_FOUND
arXiv preprint arXiv:2104.14671	Toufique Ahmed, Noah Rose Ledesma, and Premkumar Devanbu	SYNFIX:Automatically Fixing Syntax Errors using Compiler Diagnostics	2021	NOT_FOUND
arXiv preprint arXiv:2105.12787	Miltiadis Allamanis, Henry Jackson-Flux, and Marc Brockschmidt	Self-Supervised Bug Detection and Repair	2021	NOT_FOUND
2021 36th IEEE/ACM International Conference on Automated Software Engineering (ASE)	Ali S Alotaibi, Paul T Chiou, and William GJ Halfond	Automated Repair of Size-Based Inaccessibility Issues in Mobile Applications	2021	10.1109/ase51524.2021.9678625
2021 IEEE 21st International Conference on Software Quality, Reliability and Security (QRS)	Omar I Al-Bataineh, Anastasiia Grishina, and Leon Moonen	Towards More Reliable Automated Program Repair by Integrating Static Analysis Techniques	2021	10.1109/qrs54544.2021.00075
IEEE Software	Benoit Baudry, Zimin Chen, Khashayar Etemadi, Han Fu, Davide Ginelli, Steve Kommrusch, Matias Martinez, Martin Monperrus, Javier Ron Arteaga, He Ye, et al	A Software-Repair Robot Based on Continual Learning	2021	10.1109/ms.2021.3070743
arXiv preprint arXiv:2104.04611	Samuel Benton, Mengshi Zhang, Xia Li, and Lingming Zhang	Self-Boosted Automated Program Repair	2021	NOT_FOUND
International Conference on Machine Learning. PMLR	Berkay Berabi, Jingxuan He, Veselin Raychev, and Martin Vechev	TFix: Learning to Fix Coding Errors with a Text-to-Text Transformer	2021	NOT_FOUND
arXiv preprint arXiv:2107.08038	Dirk Beyer, Lars Grunske, Thomas Lemberger, and Minxing Tang	Towards a Benchmark Set for Program Repair Based on Partial Fixes	2021	NOT_FOUND
2021 14th IEEE Conference on Software Testing, Verification and Validation (ICST)	Diogo Campos, André Restivo, Hugo Sereno Ferreira, and Afonso Ramos	Automatic Program Repair as Semantic Suggestions: An Empirical Study	2021	10.1109/icst49551.2021.00032
PhD thesis. Hong Kong Polytechnic University	Liushan Chen	Effective automatic program repair based on state abstraction	2021	NOT_FOUND
Advances in Neural Information Processing Systems	Zimin Chen, Vincent J Hellendoorn, Pascal Lamblin, Petros Maniatis, Pierre-Antoine Manzagol, Daniel Tarlow, and Subhodeep Moitra	PLUR: A unifying, graph-based view of program learning, understanding, and repair	2021	NOT_FOUND
Tech. rep. 2104.08308. arXiv	Zimin Chen, Steve Kommrusch, and Martin Monperrus	Neural Transfer Learning for Repairing Security Vulnerabilities in C Code	2021	NOT_FOUND
2021 IEEE 32nd International Symposium on Software Reliability Engineering (ISSRE)	Thanh Le-Cong, Xuan Bach D Le, Quyet Thang Huynh, and Phi Le Nguyen	Usability and Aesthetics: Better Together for Automated Repair of Web Pages	2021	10.1109/issre52982.2021.00029
arXiv preprint arXiv:2108.02490	Andreea Costea, Abhishek Tiwari, Sigmund Chianasta, Abhik Roychoudhury, Ilya Sergey, et al	HIPPODROME: Data Race Repair using Static Analysis Summaries	2021	NOT_FOUND
arXiv preprint arXiv:2103.16846	Viktor Csuvik, Déniel Horvéth, Mérk Lajkó, and Lészló Vidécs	Exploring Plausible Patches Using Source Code Embeddings in JavaScript	2021	10.1109/apr52552.2021.00010
Tech. rep. 2103.12033. arXiv	Khashayar Etemadi, Nicolas Harrand, Simon Larsen, Haris Adzemovic, Henry Luong Phu, Ashutosh Verma, Fernanda Madeiral, Douglas Wikstrom, and Martin Monperrus	Sorald: Automatic Patch Suggestions for SonarQube Static Analysis Violations	2021	NOT_FOUND
PhD thesis. National University of Singapore	Xiang Gao	Overfitting in Program Repair and Synthesis	2021	NOT_FOUND
Proc. ACM Program. Lang.	Xiang Gao, Arjun Radhakrishna, Gustavo Soares, Ridwan Shariffdeen, Sumit Gulwani, and Abhik Roychoudhury	APIfix: output-oriented program synthesis for combating breaking changes in libraries	2021	10.1145/3485538
ACM Transactions on Software Engineering and Methodology (TOSEM)	Xiang Gao, Bo Wang, Gregory J Duck, Ruyi Ji, Yingfei Xiong, and Abhik Roychoudhury	Beyond Tests: Program Vulnerability Repair via Crash Constraint Extraction	2021	10.1145/3418461
arXiv preprint arXiv:2110.04101	Jingzhu He, Ting Dai, and Xiaohui Gu	TFix+: Self-configuring Hybrid Timeout Bug Fixing for Cloud Systems	2021	NOT_FOUND
2021 IEEE/ACM 43rd International Conference on Software Engineering (ICSE)	Jordan Henkel, Denini Silva, Leopoldo Teixeira, Marcelo dAmorim, and Thomas Reps	Shipwright: A Human-in-the-Loop System for Dockerfile Repair	2021	10.1109/icse43902.2021.00106
Proceedings of the 2021 Conference on Empirical Methods in Natural Language Processing	Haiwen Hong, Jingfeng Zhang, Yin Zhang, Yao Wan, and Yulei Sui	Fix-Filter-Fix: Intuitively Connect Any Models for Effective Bug Fixing	2021	10.18653/v1/2021.emnlp-main.282
2021 IEEE/ACM 43rd International Conference on Software Engineering (ICSE)	Nan Jiang, Thibaud Lutellier, and Lin Tan	CURE: Code-Aware Neural Machine Translation for Automatic Program Repair	2021	10.1109/icse43902.2021.00107
IEEE Transactions on Software Engineering	Hai Jin, Zeli Wang, Ming Wen, Weiqi Dai, Yu Zhu, and Deqing Zou	Aroc: An Automatic Repair Framework for On-chain Smart Contracts	2021	NOT_FOUND
IEEE Transactions on Software Engineering	Maria Kechagia, Sergey Mechtaev, Federica Sarro, and Mark Harman	Evaluating Automatic Program Repair Capabilities to Repair API Misuses	2021	NOT_FOUND
IEEE Software	Serkan Kirbas, Etienne Windels, Olayori McBello, Kevin Kells, Matthew Pagano, Rafal Szalanski, Vesna Nowack, Emily Rowan Winter, Steve Counsell, David Bowes, et al	On the introduction of automatic program repair in Bloomberg	2021	10.1109/ms.2021.3071086
2021 IEEE/ACM International Workshop on Automated Program Repair (APR)	William Klieber, Ruben Martins, Ryan Steele, Matt Churilla, Mike McCall, and David Svoboda	Automated Code Repair to Ensure Spatial Memory Safety	2021	10.1109/apr52552.2021.00013
Journal of Systems and Software	Roland Kretschmer, Djamel Eddine Khelladi, and Alexander Egyed	Transforming abstract to concrete repairs with a generative approach of repair values	2021	10.1016/j.jss.2020.110889
2021 IEEE 32nd International Symposium on Software Reliability Engineering (ISSRE)	Xuan-Bach D Le and Quang Loc Le	ReFixar: Multi-version Reasoning for Automated Repair of Regression Errors	2021	10.1109/issre52982.2021.00028
2021 36th IEEE/ACM International Conference on Automated Software Engineering Workshops (ASEW)	Rui Lima, Joao F Ferreira, and Alexandra Mendes	Automatic Repair of Java Code with Timing Side-Channel Vulnerabilities	2021	10.1109/asew52652.2021.00014
Journal of Systems and Software	Kui Liu, Li Li, Anil Koyuncu, Dongsun Kim, Zhe Liu, Jacques Klein, and Tegawendé F Bissyandé	A critical review on the evaluation of automated program repair systems	2021	10.1016/j.jss.2020.110817
arXiv preprint arXiv:2105.07311	Yiling Lou, Samuel Benton, Dan Hao, Lu Zhang, and Lingming Zhang	How Does Regression Test Selection Affect Program Repair? An Extensive Study on 2 Million Patches	2021	NOT_FOUND
arXiv preprint arXiv:2107.06550	Yunlong Lu, Na Meng, and Wenxin Li	FAPR: Fast and Accurate Program Repair for Introductory Programming Courses	2021	NOT_FOUND
2021 IEEE/ACM International Workshop on Genetic Improvement (GI)	Ibrahim Mesecan, Michael C Gerten, James I Lathrop, Myra B Cohen, and Tomas Haddad Caldas	CRNRepair: Automated Program Repair of Chemical Reaction Networks	2021	10.1109/gi52543.2021.00014
2021 IEEE Symposium on Security and Privacy (SP)	Tai D Nguyen, Long H Pham, and Jun Sun	SGUARD: Towards Fixing Vulnerable Smart Contracts Automatically	2021	10.1109/sp40001.2021.00057
Proceedings of VMCAI	Thanh-Toan Nguyen, Quang-Trung Ta, Ilya Sergey, and Wei-Ngan Chin	Automated Repair of Heap-Manipulating Programs using Deductive Synthesis	2021	10.1007/978-3-030-67067-2_17
2021 IEEE 32th International Symposium on Software Reliability Engineering (ISSRE)(In Press)	Amirfarhad Nilizadeh, Marlon Calvo, Gary T Leavens, and Xuan-Bach D Le	More Reliable Test Suites for Dynamic APR by using Counterexamples	2021	10.1109/issre52982.2021.00032
2021 14th IEEE Conference on Software Testing, Verification and Validation (ICST)	Amirfarhad Nilizadeh, Gary T Leavens, Xuan-Bach D Le, Corina S Psreanu, and David R Cok	Exploring true test overfitting in dynamic automated program repair using formal methods	2021	10.1109/icst49551.2021.00033
arXiv preprint arXiv:2108.13064	Yannic Noller, Ridwan Shariffdeen, Xiang Gao, and Abhik Roychoudhury	How to trust auto-generated code patches? A developer survey and empirical assessment of existing program repair tools	2021	NOT_FOUND
2021 IEEE 32nd International Symposium on Software Reliability Engineering (ISSRE)	Vesna Nowack, David Bowes, Steve Counsell, Tracy Hall, Saemundur Haraldsson, Emily Winter, and John Woodward	Expanding Fix Patterns to Enable Automatic Program Repair	2021	10.1109/issre52982.2021.00015
IEEE Transactions on Software Engineering	Nikhil Parasaram, Earl T Barr, and Sergey Mechtaev	Trident: Controlling Side Effects in Automated Program Repair	2021	10.1109/tse.2021.3124323
2021 IEEE 32nd International Symposium on Software Reliability Engineering (ISSRE)	Eduard Pinconschi, Rui Abreu, and Pedro Adão	A Comparative Study of Automatic Program Repair Techniques for Security Vulnerabilities	2021	10.1109/issre52982.2021.00031
2021 IEEE/ACM 43rd International Conference on Software Engineering: Software Engineering Education and Training (ICSE-SEET)	Kai Presler-Marshall, Sarah Heckman, and Kathryn T Stolee	SQLRepair: Identifying and Repairing Mistakes in Student-Authored SQL Queries	2021	10.1109/icse-seet52601.2021.00030
2021 IEEE International Conference on Software Analysis, Evolution and Reengineering (SANER)	Yihao Qin, Shangwen Wang, Kui Liu, Xiaoguang Mao, and Tegawendé F Bissyandé	On the Impact of Flaky Tests in Automated Program Repair	2021	10.1109/saner50967.2021.00035
Proceedings of the 42nd ACM SIGPLAN International Conference on Programming Language Design and Implementation	Kia Rahmani, Kartik Nagar, Benjamin Delaware, and Suresh Jagannathan	Repairing serializability bugs in distributed database programs via automated schema refactoring	2021	10.1145/3453483.3454028
2021 IEEE International Parallel and Distributed Processing Symposium (IPDPS)	Joseph Renzullo, Westley Weimer, and Stephanie Forrest	Multiplicative Weights Algorithms for Parallel Automated Software Repair	2021	10.1109/ipdps49936.2021.00107
30th USENIX Security Symposium (USENIX Security 21)	Michael Rodler, Wenting Li, Ghassan O Karame, and Lucas Davi	EVMPatch: Timely and Automated Patching of Ethereum Smart Contracts	2021	NOT_FOUND
Proceedings of the 42nd ACM SIGPLAN International Conference on Programming Language Design and Implementation	Ridwan Shariffdeen, Yannic Noller, Lars Grunske, and Abhik Roychoudhury	Concolic program repair	2021	10.1145/3453483.3454051
Tech. rep. 2111.12513. arXiv	André Silva, Matias Martinez, Benjamin Danglot, Davide Ginelli, and Martin Monperrus	FLACOCO: Fault Localization for Java based on Industry-grade Coverage	2021	NOT_FOUND
2021 IEEE 21st International Conference on Software Quality, Reliability and Security (QRS)	Ben Tang, Bin Li, Lili Bo, Xiaoxue Wu, Sicong Cao, and Xiaobing Sun	GrasP: Graph-to-Sequence Learning for Automated Program Repair	2021	10.1109/qrs54544.2021.00091
Findings of the Association for Computational Linguistics: ACL-IJCNLP 2021	Yu Tang, Long Zhou, Ambrosio Blanco, Shujie Liu, Furu Wei, Ming Zhou, and Muyun Yang	Grammar-Based Patches Generation for Automated Program Repair	2021	10.18653/v1/2021.findings-acl.111
