conference	authors	title	year	DOI
IEEE Software	Leonardo Trujillo, Omar M Villanueva, and Daniel Eduardo Hernandez	A novel approach for search-based program repair	2021	10.1109/ms.2021.3070552
2021 ACM/IEEE 24th International Conference on Model Driven Engineering Languages and Systems (MODELS)	Zahra VaraminyBahnemiry, Jessie Galasso, Khalid Belharbi, and Houari Sahraoui	Automated Patch Generation for Fixing Semantic Errors in ATL Transformation Rules	2021	10.1109/models50736.2021.00011
Proceedings of the 29th ACM Joint Meeting on European Software Engineering Conference and Symposium on the Foundations of Software Engineering	Chu-Pan Wong, Priscila Santiesteban, Christian Kästner, and Claire Le Goues	VarFix: balancing edit expressiveness and search effectiveness in automated program repair	2021	10.1145/3468264.3468600
2021 IEEE International Conference on Software Analysis, Evolution and Reengineering (SANER)	Deheng Yang, Yan Lei, Xiaoguang Mao, David Lo, Huan Xie, and Meng Yan	Is the Ground Truth Really Accurate? Dataset Purification for Automated Program Repair	2021	10.1109/saner50967.2021.00018
Empirical Software Engineering	Deheng Yang, Kui Liu, Dongsun Kim, Anil Koyuncu, Kisub Kim, Haoye Tian, Yan Lei, Xiaoguang Mao, Jacques Klein, and Tegawendé F Bissyandé	Where were the repair ingredients for Defects4j bugs?	2021	10.1007/s10664-021-10003-7
arXiv preprint arXiv:2106.06600	Michihiro Yasunaga and Percy Liang	Break-It-Fix-It: Unsupervised Learning for Program Repair	2021	NOT_FOUND
IEEE Transactions on Software Engineering	He Ye, Jian Gu, Matias Martinez, Thomas Durieux, and Martin Monperrus	Automated Classification of Overfitting Patches with Statically Extracted Code Features	2021	NOT_FOUND
Empirical Software Engineering	He Ye, Matias Martinez, and Martin Monperrus	Automated Patch Assessment for Program Repair at Scale	2021	10.1007/s10664-020-09920-w
arXiv preprint arXiv:2105.04123	He Ye, Matias Martinez, and Martin Monperrus	Neural Program Repair with Execution-based Backpropagation	2021	NOT_FOUND
Proceedings of ICSME	Jingtang Zhang, Kui Liu, Dongsun Kim, Li Li, Zhe Liu, Jacques Klein, and Tegawendé Bissyandé	Revisiting Test Cases to Boost Generate-and-Validate Program Repair	2021	10.26226/morressier.613b5418842293c031b5b5e6
Proceedings of the 29th ACM Joint Meeting on European Software Engineering Conference and Symposium on the Foundations of Software Engineering	Qihao Zhu, Zeyu Sun, Yuan-an Xiao, Wenjie Zhang, Kang Yuan, Yingfei Xiong, and Lu Zhang	A Syntax-Guided Edit Decoder for Neural Program Repair	2021	10.1145/3468264.3468544
Parallel Problem Solving from Nature-PPSN XVII: 17th International Conference, PPSN 2022, Dortmund, Germany, September 10-14, 2022, Proceedings, Part II. Springer	Hammad Ahmad, Padriac Cashin, Stephanie Forrest, and Westley Weimer	Digging into Semantics: Where do search-based software repair methods search?	2022	NOT_FOUND
Proceedings of the 27th ACM International Conference on Architectural Support for Programming Languages and Operating Systems	Hammad Ahmad, Yu Huang, and Westley Weimer	CirFix: Automatically Repairing Defects in Hardware Design Code	2022	10.1145/3503222.3507763
IEEE Transactions on Software Engineering	Toufique Ahmed, Noah Rose Ledesma, and Premkumar Devanbu	SYNSHINE: improved fixing of Syntax Errors	2022	NOT_FOUND
arXiv preprint arXiv:2211.03911	Omar I Al-Bataineh and Leon Moonen	Towards Extending the Range of Bugs That Automated Program Repair Can Handle	2022	10.1109/qrs57517.2022.00031
arXiv preprint arXiv:2207.11765	Rohan Bavishi, Harshit Joshi, José Pablo Cambronero Sénchez, Anna Fariha, Sumit Gulwani, Vu Le, Ivan Radicek, and Ashish Tiwari	Neurosymbolic repair for low-code formula languages	2022	10.1145/3563327
2022 IEEE/ACM International Workshop on Automated Program Repair (APR)	Gareth Bennett, Tracy Hall, and David Bowes	Some Automatically Generated Patches are More Likely to be Correct than Others: An Analysis of Defects4J Patch Features	2022	10.1145/3524459.3527348
2022 IEEE/ACM 44th International Conference on Software Engineering (ICSE)	Samuel Benton, Yuntong Xie, Lan Lu, Mengshi Zhang, Xia Li, and Lingming Zhang	Towards boosting patch execution on-the-fly	2022	10.1145/3510003.3510117
2022 IEEE/ACM 19th International Conference on Mining Software Repositories (MSR)	Quang-Cuong Bui, Riccardo Scandariato, and Nicolas Díaz-Ferreyra Ferreyra	Vul4J: A Dataset of Reproducible Java Vulnerabilities Geared Towards the Study of Program Repair Techniques	2022	10.1145/3524842.3528482
IEEE Transactions on Software Engineering	Liushan Chen, Yu Pei, Minxue Pan, Tian Zhang, Qixin Wang, and Carlo Alberto Furia	Program Repair with Repeated Learning	2022	NOT_FOUND
Proceedings of the 29th IEEE International Conference on Software Analysis, Evolution and Reengineering	Aidan Connor, Aaron Harris, Nathan Cooper, and Denys Poshyvanyk	Can We Automatically Fix Bugs by Learning Edit Operations?	2022	10.1109/saner53432.2022.00096
PhD thesis. University of California San Diego	Benjamin Cosman	PABLO and PYRITE: Helping Novices Debug Python Code Through Data-Driven Fault Localization and Repair	2022	NOT_FOUND
Journal of Systems and Software	Khashayar Etemadi, Niloofar Tarighat, Siddharth Yadav, Matias Martinez, and Martin Monperrus	Estimating the potential of program repair search spaces with commit analysis	2022	10.1016/j.jss.2022.111263
International Symposium on Research in Attacks, Intrusions and Defenses	Christof Ferreira Torres, Hugo Jonker, et al	Elysium: Context-Aware Bytecode-Level Patching to Automatically Heal Vulnerable Smart Contracts	2022	10.1145/3545948.3545975
2022 IEEE/ACM International Workshop on Automated Program Repair (APR)	Alcides Fonseca and Méximo Oliveira	Figra: Evaluating a larger search space for Cardumen in Automatic Program Repair	2022	10.1145/3524459.3527345
Proceedings of the 30th ACM Joint European Software Engineering Conference and Symposium on the Foundations of Software Engineering	Michael Fu, Chakkrit Tantithamthavorn, Trung Le, Van Nguyen, and Dinh Phung	VulRepair: a T5-based automated software vulnerability repair	2022	10.1145/3540250.3549098
arXiv preprint arXiv:2211.12787	Xiang Gao, Yannic Noller, and Abhik Roychoudhury	Program Repair	2022	NOT_FOUND
Proceedings of the 31st ACM SIGSOFT International Symposium on Software Testing and Analysis	Ali Ghanbari and Andrian Marcus	Patch correctness assessment in automated program repair based on the impact of patches on production and test code	2022	10.1145/3533767.3534368
arXiv preprint arXiv:2201.00736	Davide Ginelli, Oliviero Riganelli, Daniela Micucci, and Leonardo Mariani	Exception-Driven Fault Localization for Automated Program Repair	2022	NOT_FOUND
Proceedings of the 44th International Conference on Software Engineering	Matthías Péll Gissurarson, Leonhard Applis, Annibale Panichella, Arie van Deursen, and David Sands	PropR: property-based automatic program repair	2022	NOT_FOUND
37th IEEE/ACM International Conference on Automated Software Engineering	Simón Gutiérrez Brida, Germén Regis, Guolong Zheng, Hamid Bagheri, Thanhvu Nguyen, Nazareno Aguirre, and Marcelo Frias	ICEBAR: Feedback-Driven Iterative Repair of Alloy Specifications	2022	NOT_FOUND
arXiv preprint arXiv:2204.06643	Yaojie Hu, Xingjian Shi, Qiang Zhou, and Lee Pike	Fix Bugs with Transformer through a Neural-Symbolic Edit Grammar	2022	NOT_FOUND
Information and Software Technology	Faria Huq, Masum Hasan, Md Mahim Anjum Haque, Sazan Mahbub, Anindya Iqbal, and Toufique Ahmed	Review4Repair: Code review aided automatic program repairing	2022	NOT_FOUND
Proceedings of the 37th ACM/SIGAPP Symposium on Applied Computing	Suhwan Ji, Sang-Min Choi, Sang-Ki Ko, Dohyung Kim, and Hyeonseung Im	RepCoder: an automated program repair framework for probability-based program synthesis	2022	10.1145/3477314.3507083
Repair Is Nearly Generation: Multilingual Program Repair with LLMs	Harshit Joshi, José Cambronero, Sumit Gulwani, Vu Le, Ivan Radicek, and Gust Verbruggen	Repair Is Nearly Generation: Multilingual Program Repair with LLMs	2022	NOT_FOUND
arXiv preprint arXiv:2204.06771	Sungmin Kang and Shin Yoo	GLAD: Neural Predicate Synthesis to Repair Omission Faults	2022	NOT_FOUND
2022 IEEE Symposium on Security and Privacy (SP)	Hyungsub Kim, Muslum Ozgur Ozmen, Z Berkay Celik, Antonio Bianchi, and Dongyan Xu	PGPATCH: Policy-Guided Logic Bug Patching for Robotic Vehicles	2022	10.1109/sp46214.2022.9833567
Proceedings of the 30th ACM Joint European Software Engineering Conference and Symposium on the Foundations of Software Engineering	Misoo Kim, Youngkyoung Kim, Hohyeon Jeong, Jinseok Heo, Sungoh Kim, Hyunhee Chung, and Eunseok Lee	An empirical study of deep transfer learning-based program repair for Kotlin projects	2022	NOT_FOUND
Proceedings of the Third International Workshop on Automated Program Repair	Mérk Lajkó, Viktor Csuvik, and Lészló Vidécs	Towards JavaScript program repair with generative pre-trained transformer (GPT-2)	2022	10.1145/3524459.3527350
Computational Science and Its Applications-ICCSA 2022 Workshops: Malaga, Spain, July 4-7, 2022, Proceedings, Part IV. Springer	Mérk Lajkó, Déniel Horvéth, Viktor Csuvik, and Lészló Vidécs	Fine-tuning GPT-2 to patch programs, is it worth it?	2022	NOT_FOUND
IEEE International Conference on Software Engineering	Junhee Lee, Seongjoon Hong, and Hakjoo Oh	NPEX: Repairing Java Null Pointer Exceptions without Tests	2022	10.1145/3510003.3510186
arXiv preprint arXiv:2210.03986	Xueyang Li, Shangqing Liu, Ruitao Feng, Guozhu Meng, Xiaofei Xie, Kai Chen, and Yang Liu	TransRepair: Context-aware Program Repair for Compilation Errors	2022	10.1145/3551349.3560422
arXiv preprint arXiv:2205.01859	Yi Li, Shaohua Wang, and Tien N Nguyen	DEAR: A Novel Deep Learning-based Approach for Automated Program Repair	2022	10.1145/3510003.3510177
ACM Transactions on Software Engineering and Methodology (TOSEM)	Bo Lin, Shangwen Wang, Ming Wen, and Xiaoguang Mao	Context-aware code change embedding for better patch correctness assessment	2022	10.1145/3505247
Empirical Software Engineering, Springer	Benjamin Loriot, Fernanda Madeiral, and Martin Monperrus	Styler: learning formatting conventions to repair Checkstyle violations	2022	10.1007/s10664-021-10107-0
2022 IEEE Conference on Software Testing, Verification and Validation (ICST)	Sonal Mahajan and Mukul R Prasad	Providing Real-time Assistance for Repairing Runtime Exceptions using Stack Overflow Posts	2022	10.1109/icst53961.2022.00030
arXiv preprint arXiv:2207.11082	Matias Martinez, Maria Kechagia, Anjana Perera, Justyna Petke, Federica Sarro, and Aldeida Aleti	Test-based Patch Clustering for Automatically-Generated Patches Assessment	2022	NOT_FOUND
arXiv preprint arXiv:2211.12104	Matias Martinez, Silverio Martínez-Fernéndez, and Xavier Franch	Energy Consumption of Automated Program Repair	2022	NOT_FOUND
Proceedings of the 44th International Conference on Software Engineering	Xiangxin Meng, Xu Wang, Hongyu Zhang, Hailong Sun, and Xudong Liu	Improving fault localization and program repair with deep semantic features and transferred knowledge	2022	10.1145/3510003.3510147
Empirical Software Engineering	Marjane Namavar, Noor Nashid, and Ali Mesbah	A controlled experiment of different code representations for learning-based program repair	2022	10.1007/s10664-022-10223-5
arXiv preprint arXiv:2204.04856	Chao Ni, Kaiwen Yang, Xin Xia, David Lo, Xiang Chen, and Xiaohu Yang	Defect Identification, Categorization, and Repair: Better Together	2022	NOT_FOUND
Proceedings of ICSE	Yannic Noller, Ridwan Shariffdeen, Xiang Gao, and Abhik Roychoudhury	Trust Enhancement Issues in Program Repair	2022	10.1145/3510003.3510040
2022 IEEE International Conference on Software Analysis, Evolution and Reengineering (SANER)	Martin Odermatt, Diego Marcilio, and Carlo A Furia	Static Analysis Warnings and Automatic Fixing: A Replication for C# Projects	2022	NOT_FOUND
Proceedings of the 30th ACM Joint European Software Engineering Conference and Symposium on the Foundations of Software Engineering	Wonseok Oh and Hakjoo Oh	PyTER: effective program repair for Python type errors	2022	10.1145/3540250.3549130
IEEE Access	Quang-Ngoc Phung, Misoo Kim, and Eunseok Lee	Identifying Incorrect Patches in Program Repair Based on Meaning of Source Code	2022	10.1109/access.2022.3145983
Proceedings of the Genetic and Evolutionary Computation Conference	Pemma Reiter, Antonio M Espinoza, Adam Doupé, Ruoyu Wang, Westley Weimer, and Stephanie Forrest	Improving source-code representations to enhance search-based software repair	2022	10.1145/3512290.3528864
arXiv preprint arXiv:2202.12336	Pemma Reiter, Hui Jun Tay, Westley Weimer, Adam Doupé, Ruoyu Wang, and Stephanie Forrest	Automatically Mitigating Vulnerabilities in x86 Binary Programs via Partially Recompilable Decompilation	2022	NOT_FOUND
Proceedings of the 44th International Conference on Software Engineering	Zhilei Ren, Shiwei Sun, Jifeng Xuan, Xiaochen Li, Zhide Zhou, and He Jiang	Automated Patching for Unreproducible Builds	2022	10.1145/3510003.3510102
2022 IEEE/ACM International Workshop on Automated Program Repair (APR)	Francisco Ribeiro, Rui Abreu, and João Saraiva	Framing Program Repair as Code Completion	2022	NOT_FOUND
Proceedings of the ACM on Programming Languages	Georgios Sakkas, Madeline Endres, Philip J Guo, Westley Weimer, and Ranjit Jhala	Seq2Parse: neurosymbolic parse error repair	2022	10.1145/3563330
International Conference on Tools and Algorithms for the Construction and Analysis of Systems	Lei Shi, Yuepeng Wang, Rajeev Alur, and Boon Thau Loo	Automatic Repair for Network Programs	2022	10.1007/978-3-030-99527-0_19
arXiv preprint arXiv:2205.00180	Mifta Sintaha, Noor Nashid, and Ali Mesbah	Katana: Dual Slicing-Based Context for Learning Bug Fixes	2022	NOT_FOUND
arXiv preprint arXiv:2208.04125	Haoye Tian, Xunzhu Tang, Andrew Habib, Shangwen Wang, Kui Liu, Xin Xia, Jacques Klein, and Tegawendé F Bissyandé	Is this Change the Answer to that Problem? Correlating Descriptions of Bug and Code Changes for Evaluating Patch Correctness	2022	10.1145/3551349.3556914
Proceedings of ASE	Palina Tolmach, Yi Li, and Shang-Wei Lin	Property-Based Automated Repair of DeFi Protocols	2022	10.1145/3551349.3559560
Science of Computer Programming	Yuki Ueda, Takashi Ishio, and Kenichi Matsumoto	DevReplay: Linter that Generates Regular Expressions for Repeating Code Changes	2022	10.1016/j.scico.2022.102857
arXiv preprint arXiv:2207.06590	Yuehan Wang, Jun Yang, Yiling Lou, Ming Wen, and Lingming Zhang	Attention: Not Just Another Dataset for Patch-Correctness Checking	2022	NOT_FOUND
IEEE Transactions on Software Engineering	Emily Rowan Winter, Vesna Nowack, David Bowes, Steve Counsell, Tracy Hall, Saemundur O Haraldsson, and John Woodward	Let's Talk With Developers, Not About Developers: A Review of Automatic Program Repair Research	2022	NOT_FOUND
Information and Software Technology	Dangwei Wu, Beijun Shen, Yuting Chen, He Jiang, and Lei Qiao	Automatically repairing tensor shape faults in deep learning programs	2022	NOT_FOUND
arXiv preprint arXiv:2210.14179	Chunqiu Steven Xia, Yuxiang Wei, and Lingming Zhang	Practical Program Repair in the Era of Large Pre-trained Language Models	2022	NOT_FOUND
Proceedings of the 30th ACM Joint European Software Engineering Conference and Symposium on the Foundations of Software Engineering	Chunqiu Steven Xia and Lingming Zhang	Less training, more repairing please: revisiting automated program repair via zero-shot learning	2022	10.1145/3540250.3549101
2022 IEEE/ACM International Symposium on Code Generation and Optimization (CGO)	Xuezheng Xu, Xudong Wang, and Jingling Xue	M3V: Multi-modal Multi-view Context Embedding for Repair Operator Prediction	2022	10.1109/cgo53902.2022.9741261
Information and Software Technology	Dapeng Yan, Kui Liu, Yuqing Niu, Li Li, Zhe Liu, Zhiming Liu, Jacques Klein, and Tegawendé F Bissyandé	Crex: Predicting patch correctness in automated repair of C programs through transfer learning of execution semantics	2022	10.1016/j.infsof.2022.107043
37th IEEE/ACM International Conference on Automated Software Engineering	Deheng Yang, Xiaoguang Mao, Liqian Chen, Xuezheng Xu, Yan Lei, David Lo, and Jiayu He	TransplantFix: Graph Differencing-based Code Transplantation for Automated Program Repair	2022	10.1145/3551349.3556893
Proceedings of ASE	He Ye, Matias Martinez, Xiapu Luo, Tao Zhang, and Martin Monperrus	SelfAPR: Self-supervised Program Repair with Test Execution Diagnostics	2022	10.1145/3551349.3556926
Information and Software Technology	Jooyong Yi and Elkhan Ismayilzada	Speeding up constraint-based program repair using a search-based technique	2022	10.1016/j.infsof.2022.106865
Proceedings of the 31st ACM SIGSOFT International Symposium on Software Testing and Analysis	Wei Yuan, Quanjun Zhang, Tieke He, Chunrong Fang, Nguyen Quoc Viet Hung, Xiaodong Hao, and Hongzhi Yin	CIRCLE: Continual Repair across Programming Languages	2022	10.1145/3533767.3534219
PhD thesis. New Jersey Institute of Technology	Aleksandr Zakharchenko	A practical approach to automated software correctness enhancement	2022	NOT_FOUND
arXiv preprint arXiv:2209.14876	Jialu Zhang, José Cambronero, Sumit Gulwani, Vu Le, Ruzica Piskac, Gustavo Soares, and Gust Verbruggen	Repairing Bugs in Python Assignments Using Large Language Models	2022	NOT_FOUND
arXiv preprint arXiv:2203.05166	Quanjun Zhang, Yuan Zhao, Weisong Sun, Chunrong Fang, Ziyuan Wang, and Lingming Zhang	Program Repair: Automated vs. Manual	2022	NOT_FOUND
arXiv preprint arXiv:2203.09009	Ying Zhang, Ya Xiao, Md Mahir Asef Kabir, Na Meng, et al	Example-Based Vulnerability Detection and Repair in Java Code	2022	10.1145/3524610.3527895
37th IEEE/ACM International Conference on Automated Software Engineering	Wenkang Zhong, Hongliang Ge, Hongfei Ai, Chuanyi Li, Kui Liu, Jidong Ge, and Bin Luo	StandUp4NPR: Standardizing SetUp for Empirically Comparing Neural Program Repair Systems	2022	10.1145/3551349.3556943
arXiv preprint arXiv:2202.10868	Wenkang Zhong, Chuanyi Li, Jidong Ge, and Bin Luo	Neural Program Repair: Systems, Challenges and Solutions	2022	NOT_FOUND
Empirical Software Engineering	Zhou Zhou, Lili Bo, Xiaoxue Wu, Xiaobing Sun, Tao Zhang, Bin Li, Jiale Zhang, and Sicong Cao	SPVF: security property assisted vulnerability fixing via attention-based models	2022	10.1007/s10664-022-10216-4
arXiv preprint arXiv:2212.11414	Armin Zirak and Hadi Hemati	Improving Automated Program Repair with Domain Adaptation	2022	NOT_FOUND
Proceedings of the ACM on Programming Languages	Daming Zou, Yuchen Gu, Yuanfeng Shi, MingZhe Wang, Yingfei Xiong, and Zhendong Su	Oracle-free repair synthesis for floating-point programs	2022	10.1145/3563322
arXiv preprint arXiv:2305.10092	Joachim Bard, Swen Jacobs, and Yakir Vizel	Automatic and Incremental Repair for Speculative Information Leaks	2023	NOT_FOUND
arXiv preprint arXiv:2304.12743	Islem Bouzenia, Yangruibo Ding, Kexin Pei, Baishakhi Ray, and Michael Pradel	TraceFixer: Execution Trace-Driven Program Repair	2023	NOT_FOUND
arXiv preprint arXiv:2305.14752	Yiannis Charalambous, Norbert Tihanyi, Ridhi Jain, Youcheng Sun, Mohamed Amine Ferrag, and Lucas C Cordeiro	A New Era in Software Security: Towards Self-Healing Software via Large Language Models and Formal Verification	2023	NOT_FOUND
IEEE Transactions on Software Engineering	Thanh Le-Cong, Duc-Minh Luong, Xuan Bach D Le, David Lo, Nhat-Hoa Tran, Bui Quang-Huy, and Quyet-Thang Huynh	Invalidator: Automated patch correctness assessment via semantic and syntactic reasoning	2023	10.1109/tse.2023.3255177
arXiv preprint arXiv:2302.01707	Thomas Durieux	Parfum: Detection and Automatic Repair of Dockerfile Smells	2023	NOT_FOUND
Proceedings of ICSE	Zhiyu Fan, Xiang Gao, Abhik Roychoudhury, and Shin Hwei Tan	Automated Repair of Programs from Large Language Models	2023	10.1109/icse48619.2023.00128
arXiv preprint arXiv:2305.16615	Michael Fu, Chakkrit Tantithamthavorn, Trung Le, Yuki Kume, Van Nguyen, Dinh Phung, and John Grundy	AIBugHunter: A Practical Tool for Predicting, Classifying and Repairing Software Vulnerabilities	2023	10.1007/s10664-023-10346-3
arXiv preprint arXiv:2303.18184	Kai Huang, Zhengzi Xu, Su Yang, Hongyu Sun, Xuejun Li, Zheng Yan, and Yuqing Zhang	A Survey on Automated Program Repair Techniques	2023	NOT_FOUND
arXiv preprint arXiv:2305.07287	Dominik Huber, Matteo Paltenghi, and Michael Pradel	Where to Look When Repairing Code? Comparing the Attention of Neural Models and Developers	2023	NOT_FOUND
2023 IEEE Conference on Software Testing, Verification and Validation (ICST)	João Inécio and Ibéria Medeiros	CorCA: An Automatic Program Repair Tool for Checking and Removing Effectively C Flaws	2023	10.1109/icst57152.2023.00016
arXiv preprint arXiv:2307.12465	Naman Jain, Shubham Gandhi, Atharv Sonwane, Aditya Kanade, Nagarajan Natarajan, Suresh Parthasarathy, Sriram Rajamani, and Rahul Sharma	StaticFixer: From Static Analysis to Static Repair	2023	NOT_FOUND
Proceedings of ICSE	Nan Jiang, Kevin Liu, Thibaud Lutellier, and Lin Tan	Impact of Code Language Models on Automated Program Repair	2023	10.1109/icse48619.2023.00125
arXiv preprint arXiv:2302.01857	Nan Jiang, Thibaud Lutellier, Yiling Lou, Lin Tan, Dan Goldwasser, and Xiangyu Zhang	KNOD: Domain Knowledge Distilled Tree Decoder for Automated Program Repair	2023	10.1109/icse48619.2023.00111
arXiv preprint arXiv:2303.07263	Matthew Jin, Syed Shahriar, Michele Tufano, Xin Shi, Shuai Lu, Neel Sundaresan, and Alexey Svyatkovskiy	InferFix: End-to-End Program Repair with LLMs	2023	10.1145/3611643.3613892
2023 IEEE/ACM 45th International Conference on Software Engineering (ICSE)	Xiangxin Meng, Xu Wang, Hongyu Zhang, Hailong Sun, Xudong Liu, and Chunming Hu	Template-based Neural Program Repair	2023	10.1109/icse48619.2023.00127
International Conference on Software Engineering (ICSE)	Manish Motwani and Yuriy Brun	Better Automatic Program Repair by Using Bug Reports and Tests Together	2023	10.1109/icse48619.2023.00109
arXiv preprint arXiv:2304.10379	Ruba Mutasim, Gabriel Synnaeve, David Pichardie, and Baptiste Rozière	Leveraging Static Analysis for Bug Repair	2023	NOT_FOUND
Proceedings of ICST	Noor Nashid, Mifta Sintaha, and Ali Mesbah	Embedding Context as Code Dependencies for Neural Program Repair	2023	10.1109/icst57152.2023.00018
2023 IEEE/ACM 45th International Conference on Software Engineering (ICSE)	Nikhil Parasaram, Earl T Barr, and Sergey Mechtaev	Rete: Learning Namespace Representation for Program Repair	2023	10.1109/icse48619.2023.00112
arXiv preprint arXiv:2305.08592	Yu Pei, Jeongju Sohn, Sarra Habchi, and Mike Papadakis	TRaf: Time-based Repair for Asynchronous Wait Flaky Tests in Web Testing	2023	NOT_FOUND
arXiv preprint arXiv:2306.01394	Yun Peng, Shuzheng Gao, Cuiyun Gao, Yintong Huo, and Michael R Lyu	Domain Knowledge Matters: Improving Prompts with Fix Templates for Repairing Python Type Errors	2023	NOT_FOUND
arXiv preprint arXiv:2304.01102	Julian Aron Prenner and Romain Robbes	RunBugRun-An Executable Dataset for Automated Program Repair	2023	NOT_FOUND
arXiv preprint arXiv:2304.02301	André Silva, João F Ferreira, He Ye, and Martin Monperrus	MUFIN: Improving Neural Repair Models with Back-Translation	2023	NOT_FOUND
Tech. rep.	Dominik Sobania, Martin Briesch, Carol Hanna, and Justyna Petke	An Analysis of the Automatic Bug Fixing Performance of ChatGPT	2023	10.1109/apr59189.2023.00012
PhD thesis. Nanyang Technological University	Palina Tolmach	Securing smart contracts with formal verification and automated program repair	2023	NOT_FOUND
arXiv preprint arXiv:2305.18607	Yi Wu, Nan Jiang, Hung Viet Pham, Thibaud Lutellier, Jordan Davis, Lin Tan, Petr Babkin, and Sameena Shah	How Effective Are Neural Networks for Fixing Security Vulnerabilities	2023	10.1145/3597926.3598135
arXiv preprint arXiv:2303.10494	Chunqiu Steven Xia, Yifeng Ding, and Lingming Zhang	Revisiting the Plastic Surgery Hypothesis via Large Language Models	2023	NOT_FOUND
Proceedings of the 45th International Conference on Software Engineering (ICSE 2023)	Chunqiu Steven Xia, Yuxiang Wei, and Lingming Zhang	Automated program repair in the era of large pre-trained language models	2023	10.1109/icse48619.2023.00129
arXiv preprint arXiv:2304.00385	Chunqiu Steven Xia and Lingming Zhang	CKeep the Conversation Going: Fixing 162 out of 337 bugs for $0.42 each using ChatGPT	2023	NOT_FOUND
arXiv preprint arXiv:2301.13246	Chunqiu Steven Xia and Lingming Zhang	Conversational automated program repair	2023	NOT_FOUND
arXiv preprint arXiv:2305.03955	Yuan-An Xiao, Chenyang Yang, Bo Wang, and Yingfei Xiong	Accelerating Patch Validation for Program Repair with Interception-Based Execution Scheduling	2023	NOT_FOUND
PhD thesis. KTH Royal Institute of Technology	He Ye	Improving the Precision of Automatic Program Repair with Machine Learning	2023	NOT_FOUND
arXiv preprint arXiv:2304.12015	He Ye and Martin Monperrus	ITER: Iterative Neural Repair for Multi-Location Patches	2023	NOT_FOUND
arXiv preprint arXiv:2301.03270	Quanjun Zhang, Chunrong Fang, Yuxiang Ma, Weisong Sun, and Zhenyu Chen	A Survey of Learning-based Automated Program Repair	2023	10.1145/3631974
arXiv preprint arXiv:2301.12453	Quanjun Zhang, Chunrong Fang, Weisong Sun, Yan Liu, Tieke He, Xiaodong Hao, and Zhenyu Chen	Boosting Automated Patch Correctness Prediction via Pre-trained Language Model	2023	NOT_FOUND
arXiv preprint arXiv:2305.09315	Yuwei Zhang, Ge Li, Zhi Jin, and Ying Xing	Neural Program Repair with Program Dependence Analysis and Effective Filter Mechanism	2023	NOT_FOUND
arXiv preprint arXiv:2303.002022	Xin Zhou, Bowen Xu, Kisub Kim, DongGyun Han, Thanh Le-Cong, Junda He, Bach Le, and David Lo	PatchZero: Zero-Shot Automatic Patch Correctness Assessment	2023	NOT_FOUND
